5,Хороший шнур, матовое покрытие, приятная на ощупь, хороший подбор материалов. Все сделано качественно. Если ищите недорогую,красивую и качественную мышь - рекомендую.
5,Удобная мышка со стильным дизайном. Мне понравилась. Особенно хочу отметить возможность переключения режимов DPI - хорошо подойдет как для работы, так и для игр.
5,Неделю как пользуюсь данной мышкой. Небольшой недостаток - для меня слегка маленькая) После х7 непривычно было сперва, но сейчас уже привык, и играть и работать удобно. Красивая подсветка, сам дизайн приятный, высота отрыва что надо. В общем, за свои деньги мышка вообще идеальная. Прошла неделя - замечаний нет. Покупкой доволен, советую как игровую брать (отличный бюджетный вариант) так и для обычного пользования.
4,Ну что сказать, дизайн мыши отличный,в руке сидит даже очень хорошо,у меня средняя ладонь,ей бы соф тач покрытие ей бы цены не было, подсветка норм, автоматическая, настроить или изменить что либо в подсветке нету возможности (меняется сама), шнур добротный обшитый с эффектом памяти, люфтит даже очень колесико щелчки прокрутки колесика практически не ощутимы ( это для меня - ) но это дело каждого, поюзал пол часика в cs-go, скажу для мыши за такие деньги лучше просто нет, если сравнивать с предыдущей моей Tesoro Sharur у которой цена в два раза больше то для шутеров типо кс советую брать именно эту. с высотой отрыва проблем нет. Доставка быстрая, но хотел бы сказать огромное спасибо представителю компании который с нетерпением ждал и не отозвал мышь обратно, но это совсем другая история.+ больше чем минусов, всем советую, за такие деньги я лучьшего не видел.
5,Ну что могу сказать ! Только что получил эту мышь !! Товар пришел быстро , Отличный сервис .... Порадовала качество обслуживания и упаковки, в руке сидит удобно ) мне чем то даже больше чем киро лежит в руке, а что бы я хотел так фиксировать отдельный цвет )) ну это излишки) Ах да, еще забыл.... клик резкий и четкий
5,Всё работает отлично. Товаром доволен. С таким девайсом грех не зайти в CS:GO :). Советую!
