5,Добрый день. Скажите какой вес устройства (без коробки)?
1,Заказал данную мышь только исходя из комментария дистрибьютора 4buy где он писал что "сенсор не срывает" и для шутеров данная мышь подойдет (фото комментария прикрепил) На деле же, оказалось что сенсор срывает, тестировал на разных ковриках, но результат удручающий, сенсор срывает. Так же, в описание указанно что минимальный dpi 800, на деле же оказалось что минимальный dpi 1600, что тоже не особо радостно. В общем, крайне не советую брать эту мышь для "шутеров" И надеюсь что у меня получиться вернуть обратно эту мышь и получить свои деньги
5,Какой установлен сеснор?
5,Мышка хорошая играть одно удовольствие но нету дисковода для драйвера можно ссылку где можно скачать?
5,Классные характеристики у мышки, а какое покрытие у нее?
5,Добрый день! Мои знакомые советуют ваш товар!Подскажите в комплекте есть утяжелители?
