5,норм
4,Загалом хороша мишка, крім вказаних недоліків.
5,удобная радио мышь
5,покупал еще года три назад
5,отличная мышка для ноутбука
1,До этого у меня была эта мышь, я пользовалась ею несколько лет, она сломалась. Я купила такую же. и вот вчера, после пары месяцев пользования, вдруг случилось неожиданное. Компьютер стал вести себя неадекватно. Он стал открывать команду "выполнить" вписывать в нее адрес какого-то сайта, стали открываться программы в хаотичном порядке, компьютер стал делать скриншоты экрана, в браузере открывалась куча вкладок. Я пыталась выключить компьютер, но он на меня не реагировал, я была заблокирована, как пользователь собственного компьюетра. Подозрений на мышь, естественно, не было. Я отнесла ноутбук в мастерскую (мышку) забыла дома. И мастер, включив его, и компьютер работал нормально. Я оставила его для диагностики. Пришла домой, а планшет, телефон и второй компьютер не подключаются к нашему вай-фаю, он для нас тоже был заблокирован. Мы поколдовали с роутером, чтобы заново настроить сеть. На следующий день я пола забирать ноутбук, на этот раз мышь была при мне, и тут компьютер стал выдавать те же финты. Мастер отключил мышь, подключил ее к своему компьютеру и он тоже начал сходить с ума. Это ужас какой-то. Придется ее выбросить.
4,Мышь, как мышь... Пока работает :)
5,Все отлично работает. Батарейки хватило на 5 месяцев активного использования.
2,про работу мыши на поверхности с ворсом - явный рекламный обман. Брал эту мышку именно для этого - разочаровала, на ковре работает очень плохо, на столе - как и любая другая мышь
5,Отличная мышка. Не маленькая как обычно, но хотелось бы побольше, как для парня с нормальной рукой. К стати, кто спрашивал, с 10 работает на ура.
4,Выбирала мышку на подарок. Любимому очень понравилось. Для него она как раз, а для моей руки считаю крупноватой, так как у меня мышь Genius очень легкая и маленькая в сравнении с A4 Tech этой модели.
5,Она чудесна, мне подошла во всём, работает уже больше года, исправна во всём.
4,Хорошая мышь за свои деньги.
4,Все ок, працює більше року чудово! Але батарейки часто сідають((
5,Пользуюсь уже около 4-х месяцев. Нареканий никаких нет. Отличная мышь по очень доступной цене.
5,Удобная, работает устойчиво... Купить к ней аккумулятор вместо батареи с зарядным устройством (у меня это "хозяйство" уже было) и вообще можно забыть про батарейки!... К смарт ТВ подошла идеально!...
5,Много писать не буду, покупкой доволен, пользуюсь мышкой уже более полу года ))
5,Всегда покупаю предварительно почитав отзывы.И на этот раз не ошибся.Всем доволен.И "Розеткой" тоже.
5,Эта мышь прекрасна! Эргономичная , прекрасно лежит в ладошке , быстрая , действительно работает на чем угодно. Для ноутбука очень удобно. Закажу ещё одну .
4,Неплохая мишка за хорошую цену.
5,Супер мыша, удобная, компактная! Всем рикомендую!!!
5,зручна мишка
5,Очень хорошая мышь, берет с 5 метров))) курсор точный, без глюков. Взяли одну для ребенка, но так понравилась всей семье, что будем еще заказывать. Единственно, что она очень неприятно пахнет пластиком, да так, что руки потом запах имеют((( Но, может, это пока новая...
4,за эти деньги хорощее качество
5,Это уже третья :-). Первые две брал не здесь. Все три брал в подарок. Адресаты довольны. Особенно отмечают возможность работы на любой поверхности.
5,Полностью доволен покупкой)быстро доставили
4,Купував цю мишку ще в минулому (2014) році по акційній ціні. Після незначних тестів мишка зарекомендувала себе як "всюдипрохідний звір". Прекрасний вибір для ноута та офісних задач. Прекрасно себе зарекомендувала як на Linux (Mint) так і на Windows (7). Замітив що батарейка що йде в комплекті довго не живе. Зараз стоїть батарейка від philips, живе вже удвічі довше за ту що в комплекті. Для ігор не рекомдую її використовувати бо в цьому плані може підвести і зіпсувати враження =)
3,Неплохой товар за свою цену, но не для активного пользования
3,Купил два месяца назад. Выбор стоял между этой мышью и "Genius NX-6500 Wireless Metallic Silver". Но так как в семью нужно было две мыши одновременно, взял и ту, и другую. Что касается данной мыши (A4 Tech), то она хорошо лежит в руке. Во всём остальном - плохо. Ей нужна только идеальная поверхность. Чёткости нажатия клавиш как в "Genius" нет. В общем, хорошо, что взял разные мыши. Больше "A4 Tech" брать не хочу!
4,Мышь попалась с дефектом (левая кнопка произвольно нажималась). Поменяли на нормальную без всяких проблем.
4,Хорошая мышь,своих денег стоит.
3,Нормальная мышь, но только для решения обычных задач: офис, интернет. В игры играть не удобно.
4,Отличная вещь, с небольшими нюансами за небольшие деньги. Для смарт ТВ незаменимая вещь, только в постель ее не советую брать, так как из-за отсутствия лампочек она просто затеряется в одеялах.
4,Удобная, легкая, не дорогая.
3,Через год начала ужасно глючить, постоянно нужно вытягивать, вставлять батарейку.
5,Дуже гарний бюджетний варіант для ноутбука
5,Хорошая радио мышь средних размеров
5,Хороша миша, тільки розмір маленький (варіант для ноутбука)
4,Все бы ничего, но развалился передатчик, еле вытянул остатки из порта USB. Пришлось клеить суперклеем. В остальном - нормальный мыш
4,пошел уже 4й месяц
5,за такую цену лучше не найти.
4,
5,Мышь понравилась, рекомендую!
5,Зручна мишка , дуже задоволений !
5,очень хорошая беспроводная мышка, очень удобная даже для большой руки, для работы за компьютером - вполне достаточно. Также работает и на неровных и ковровых покрытиях, как было заявлено в описании. 5+
4,
5,Хорошая мышка. Кому-то показалось, что громко кликает, но на самом деле не громко. Цена = качество - это верно. Дополнительным софтом (16 в 1 от a4tech) можно изменять настройки мыши (в том числе и время, через которая мышь "засыпает"). Скромный дизайн.
5,Купила недавно, якраз те, що було потрібно.
5,Мышка, отличная, удобная, недостатков пока не обнаружил - 1 мес.
4,По акционной цене довольно таки хорошая мышка
4,Загалом задоволений, про покупку не шкодую. Для чоловіків вона може бути малою. Мені спочатку зі своїми досить довгими пальцями було незручно нею користуватися, але згодом я звик і тепер зовсім цього не помічаю.
5,Мишка чудова! Головне зручна))
5,Чудова мишка! Ціна-якість на 5+
5,Очень удобная мышь. Не большая и не маленькая. Удобно помещается в руке. Работает на любой поверхности.
5,Удобная, хорошо лежит в руке. Правда клики чуть громкие
5,за такую цену отличная мышь
5,супер грызун,рекомендую
5,Брали мышку не в резетке, ишла по акции с ноутбуком. Мышка превосходная, работает на любой поверхности, батарейки хватает о-о-очень на долго. Пользуюсь ей уже 3-4 месяца. Берите не пожалеете! ;)
3,Если некритичный вопрос замены батареи, удобная мышка
5,супер, не ожидал! приятная мышь! отключается сама для экономии батареи, чтобы включить нужно только щелкнуть кнопкой!
5,Хорошая мышка за отличную цену! только вот она не среднего размера-а реально маленькая. Для маленькой девичьей ручки подойдет нормально. а вот для руки парня не очень.
5,Миша суперова! Зручна, стильна. Можна навіть у ліжку користуватися. За таку ціну відмінна річ. Раджу всім!
5,На картинке она кажется мелкой. На самом деле имеет стандартные средние размеры.
5,Покупал не в розетке (на момент покупки не было в наличии). Остался очень доволен покупкой. Мышь среднего размера, что важно. Из руки не ускользает, как другие мыши меньших размеров. Есть спящий режим. Просыпается от щелчка. Есть выключатель питания. Никакой индикации разряда батарейки нет. Проверял слабозаряженным аккумулятором, просто перестает двигаться. Проработала месяц без выключения на старой батарейке при нагрузке в день примерно 9 часов. Сейчас наблюдаю за новой батарейкой. Не зависает, не тормозит, хотя не очень хорошо работает на чисто белой поверхности (бумажном листе). На столе, ковре и ткани работает без проблем и на большом расстоянии (пробовал из соседней комнаты). Адаптер ставил на заднюю стенку системника. Драйвера не нужны. Горизонтальная прокрутка и др. функции правой клавиши реализуется установкой программы 16-in-1 с сайта производителя. Есть небольшой холостой ход клавиш между свободным положением и микриком внутри, но особо не влияет на работу. Из-за этого возможно громче щелчок, хотя микрик клацает не громче других мышей. На вид пластик тонковат и не солиден, но не прогибается и не разваливается. Батарейка одна AA (толстый пальчик). Сын играл в игры и остался доволен. Шустрая.
5,Грызуна брал спецом для домашнего медиа устройства на андроиде. Перед этим попробовал ее на домашнем зверинце, от Mac mini (OS X 10.8.2), ПК (Win7 64) до Rikomagic (Android 4.1.1). На всех устройствах мышь распозналась и чуствует себя отлично. Если честно, то я реально ошарашен качеством и функционалом грызуна всего лишь за 107грн. Курсор весьма чуствительный, можно обрабатывать несложную графику в Photoshop, тут нет эффекта как "в киселе", курсор двигается очень четко и быстро реагирует. Звук клика правой и левой клавиши стандартный, он такой же как и дорогих моих мышей. Дизайн коробки весьма презентабелен, в комплекте идет батарейка АА (alcaline) и это все за 107грн!!! Короче, для тех, кому надо простенькая радио мышь, для серфинга инета, для офисных приложений и несложной графики, то равных ей нет в сочетании цена=качество.
5,Хорошая мышка, подключилась моментально, все работает, минималистический дизайн,средний размер не маленькая не большая, пойдет для женщин так и для мужчин.
5,В целом доволен, даже очень, за сотку -радио мыш, - еще и на постели можно пользоватся.
5,Отличная мышь за свои деньги !!!
