4,Удачное сочетание возможностей и цены
4,вроде хорошая мышь
4,всем хороша мышка, только вот кнопка которая, на сколько я вычитал из комментов, за двойной клик отвечает - в играх воспринимается как ЛКМ, соответственно возможность на неё что-то повесить отпадает. я правда не пробовал настроить в винде, может какой-то драйвер нужен...
4,В целом рабочая, качественная вещь.
5,Пользуюсь этой моделью уже 10 лет. У меня её срок годности был около 5-ти лет. Причина покупки новой - резина на кабеле изнашивается - рвется и мышь, в местах изнашивания кабеля, бьется током. Но! Конкретно у меня, это связано с тем, что кот периодически грызет кабель. Если бережно относиться к мыши, уверена - она прослужит и дольше. По-поводу того, что она работает на разных поверхностях - подтверждаю. Я другой не пользовалась, не думала, что это достоинство.
4,за такие деньги - отличный выбор!
4,Ітак! Уже достааааатньо довго юзаю дану мишку в парі з ноутом. Зразу без води по порядку: 1) Дизайн. Маленька, іде в любу руку, окрім тих, хто грає у всякі ігрулі на грамоздких мишаках. 2) Функціонал. Завдяки "рулєточці" її можна підключати як тобі хочеться, а якщо ваш ноут "обділили" і поставили роз"єми аж під екраном - не біда. Довжини кабелю вистачить щоб обігнути екран 15". 3) Швидкодія. Тут даємо плюсік в карму за "закрите" дніщє. Мишка працює на будь-якій поверхні, окрім бито/тріснутого скла і тріснутих напів і повністю ламінованих ковриків від PODMYSHKU, причому з останнім повний фейл. Сумуючи вище перечислене + людський фактор хочеться сказати, що дана мишка ідеально підійде для всіх, окрім про геймерів. Вона сидить в руці досить пристойно, слідує вашим рухам моментально. Можна її юзати як на столі, так і на склі, покривалі, коті, частинах тіла, землі (так, вона і на землі працює шустро). Тепер по мінусам: 1) Лапшовий кабель паганий, оскільки проводки туди дають вкрай неякісні. А тут щей "рулєточка", яка потрошки пошкоджує провід 2) "Рулєточка" не панацея. І вона досить хоч не часто та помітно таки глючить. Пошкоджує проводку всередині ітак паршивого тпу кабелю. 3) Не знаю як у кого, але в мене і (згідно інфі з СЦ) у багатьох цих мишках кабель коротить. В результаті горить до чортиків мозок мишки, і вона стає непотребом. ПІДСУМОВУЮЧИ УСЕ! 2.5 роки без нарікань - рекорд взагалі будь чого в моїх руках, тому впевнено можу сказати - БЕРІТЬ ЇЇ! Не пожалкуєте. Плюси повністю нівелюють мінуси, які можуть так і залишитись непомітними.
5,Брала для ноутбука, не пожалела.
5,Отличная мышь!
5,Твердый рабочий мышь )))
4,плохое описание, плоский провод.
5,Все устраивает, но. Где-то читал, что можно ее перепрограммировать, но не понял как это. Подскажите пожалуйста.
5,если нет разъемов справа для мышки не очень удобно пользоваться
5,Хорошая мышка для ноута самый раз
5,Три года использовал мышь X5-60MD.Мышь для ноута просто не заменимая.Была...пока не умерла. Вот купил данную модель! мышь просто чудо,без нее на ноуте сразу как-то не комфортно стало работать. маленькая,чувствительная и компактная. много функций можно настроить скачав драйвер с официального сайта.
5,Когда первый раз подключил мышь был в ступоре, так как нетбук не включался... Проблема была сразу решена так как мышь просто нужно было включить уже после того как нетбук включился, а так работает отлично уже второй год :)
5,Рекомендую тем, кто таскается с ноутом и не любит тач.
5,всем рекомендую фирма хорошая.
5,работаю довольно много за компьютером с данной мышкой уже больше года и все устраивает.
5,удобная и чувствительная. компактная. мне нравится
4,Пользуюсь мышью уже 6 месяцев практически каждый день. Покупала для ноутбука. Работает отлично на разных поверхностях, маленькая и удобная.
5,Придбав цю Мишу майже рік назад,працює бездоганно,жодних недоліків поки не помітив!!!
5,Отличная мышь для ноутбука. Для работы мне её вполне достаточно, быстро бегает, не тормозит, не габаритная, удобно переносить. Довольна)
5,Хорошая мышка, пользуюсь 5 лет. Вот только на днях контакты начали отходить. На замену возьму такую же. Советую, не дорогая, маленькая, удобная.
5,компактна, реагує добре для ноута саме то
5,Приобрела 2 недели назад. Маленькая, удобная, не дорогая. Плюс: кнопка двойного клика мне очень кстати.
5,есть еще предыдущая модель (абсолютно живая, только меньше dpi) и я до сих пор считаю что это самый лучший мобильный вариант мыши. Провод качественный, за 3+ года работы только резиновые вставки стерлись, все работает как в первый день.
4,Пользуюсь уже пару недель! Вполне доволен покупкой!
