5,Подходит ли данная модель для geometry dash?
5,Отличная мышь за разумную цену! Хорошая эргономика, хорошо скользит... и особенно подойдет тем, кто любит цветастые и светящиеся вещи! Единственное, в руке сидит не привычно и обхват не привычный, после другой игровой мыши, но думаю, это индивидуально для каждого! Со временем привык.
5,Можно также положить на мышь все пальцы, что есть плюсом. Оч. красивая в оформлении , только ночью отключайте подсветку(что бы родители не спалили xD) , оч. яркая. Есть тройной клик. Кароч, если хотите норм игровую мышь по низкой цене, - покупайте эту.
5,В принципе мышка удобная. Только я не разобрался как менять подсветку и можно ли вообще
5,Удобная мышка, ложится в руку. Две наклейки в комплекте, можно друзьям подарить. Светится красиво, только не понятно пока что как поменять параметры для подсветки. Сервис розетки на высоте, как всегда. #мояраспаковка
5,Для майнкрафта хороша удобно играть
4,Для шутеров или ммо рпг мышки блади топ. Если для майнкрафта, конечно либо "Razer Deathadder 3500" либо "Razer Deathaddder 2013"
