5,Мышка в целом нравится. Хорошо лежит в руке, привыкаешь быстро. Функциональная правая кнопка + колёсико, в работе очень помогает. Для игр тоже весьма подходит, специальные геймерские мышки в топку.
5,Користуюсь вже дуже давно перед нею мав такуж але провіду а там захист внизу стояв на оптиці.
4,чудова річ, удобна, далекий прийом
1,за пару часов игры в WOT полностью разряжается, постоянно пропадает сигнал! не советую покупать для игр и работы!!!
5,Класна штучка. Брав лише для того щоб вирішити проблему з дротами. Працює вже 1,5 роки. Нарікань не маю. І мати не буду. Якщо б щось сталось тьху тьху. Куплю на заміну таку ж.
3,второй раз не купила бы, имяя мышь по большей части использую тач пад
