5,Отличная мышка, покупаю во второй раз, прослужила долго но в виду моей активной работы в AutoCAD и ArchiCAD, начало глючить колесо прокрутки при нажатии, ну и стерлась краска на левой кнопке, думаю, если юзать её только для интернет серфинга и офиса, то мышка продержалась бы намного дольше. Отлично подходит для ноутбука, провод короткий то что надо, не мешает под рукой постоянно. Правда первую такую мышку покупала не в розетке, она отличается немного, хотя модель та же самая, например, в старой мышке была глянцевая синяя краска, а в новой она уже матовая, ну и по ощущениям новая словно бы немного легче. Покупкой все равно довольна, мышку другой модели даже не искала, привыкла работать с этой.
5,Покупал второй раз, в первый раз брал для себя, а во второй для матери. В первый раз очень понравилась, а во второй не разочаровался
4,за свои деньги неплохая мышь
3,мышка супер к ноутбуку подошла но уже начинает розшативатся USB
5,Купил мышку с доставкой, правда день ждал, заказывал товар 19.12.15 в 11:59, где - то в пол третего позвонил оператору, он сам мне переоформил заказ, Это просто восхитительно, на номер за день пришло 3 смс с даными о заказе, Большая блогодарность Вашему магазину, меня просто поразило Ваше Обслуживание клиентов, Также хочу выразить Блогодарность Оператору Евгению, за Обслуживание. Так же доставщику моей посылки, Ввежливый хороший человек. Спасибо Вам Огромнейшое!
3,У меня юсб разъем расположен слева, приходится подключать мышку через удлинитель юсб, т.к. провод не дотягивается.
4,Длина кабеля маленькая, а так впрочем очень даже не плохо!
4,Обычная мышка.
5,Ребята мышка шикарная просто)Моя накрылась передавила шнура)Но без сомнений куплю такую же)
4,Удобная мышка, хорошо сидит в руке. Единственный минус 0,5 м. шнур, далеко сесть от ноутбука не получиться. Покупкой доволен !
4,Мышка вроде ничего.удобная.небольшие размеры-работает отлично.
5,Мишка просто супер
4,Мышь хорошая, выглядит интересно, но с кабелем подкачали - разве что для ноута будет нормально. 8 функций устанавливала, но так ими и не воспользовалась. Кроме того очень нескоро смогла привыкнуть к маленькому размеру (это скорее даже для детских ручек мышка). В целом - нормально.
4,Пользуюсь уже 10 месяцев, в целом доволен
4,Одна кнопка - 8 функций. Если вы хотите сделать свою работу за компьютером более легкой и быстрой, назначьте все необходимые функции на правую кнопку мыши. В зависимости от направления движения руки она может выполнять до 8 различных функций, например, «Увеличить/Уменьшить», «Прокрутка влево/Прокрутка вправо», «Копировать/Вставить» и т.д. Для выполнения выбранной команды нужно провести мышью в заданном направлении, удерживая кнопку.
5,прикольная мышка ) купил юзаю неделю
4,Сегодня купил. Сначала удивили размеры, уж больно она маленькая, но все таки не разочаровала. Очень понравилась.
4,Цена-качество соответствует.
