5,Отличная,бюджетная геймерская мышь !Лет пять назад покупал такую и остался доволен.Перетёрся за шесть лет только провод и да,оторвалась сбоку резиночка под палец.Очень доволен что в данной модели всё это исправили. Под палец резинку не стали клеить,шнур теперь в защитном покрытии от перетирания! Очень и очень радует это Советую всем,кто ищет бюджетную,геймерскую мышь.
5,Была эта мышка только чуть другая. Отработала 10 лет (!!) не давно перестало реагировать колесико, хочу брать такую же. Мышка прекрасная, за 10 лет работы несколько разменял провод, мышка жила довольно в жестких условиях(падения, поливание чего ни будь). Вообщем за такие относительно не большие деньги мышка превосходит все ожидания.
4,Взял не здесь на замену старой (к сожалению сломавшейся) a4tech WOP-35. Пользуюсь уже полгода. Эта мышь вроде неплоха, точнее даже хороша. Кнопки можно запрограммировать на достаточно сложные комбы для разных игр. Из руки вроде не выскальзывает. Но не полностью удовлетворительно ощущение от нее по сравнению со старой WOP-35. Хотелось бы узнать от представителя существует ли еще среди не "снятых с производства" мыши аналогичные по типоразмеру WOP-35(наличие двух колес не сильно критично, но хотелось бы чтобы хват был таким же) сам я что-то не могу по фото найти похожие в розетке. Из подобных типоразмеров поновее встречал в сети a4tech X6-35WD, но она кажется тоже уже "снята с производства".
5,Отличная мышка , 2 кнопки с боку очень помогают !!! брал 2 или 3 года назад , до сих пор живет , менять не собираюсь !
5,Купил, попользовался пару недель. Все нравится, лучшая мышка которой пользовался
5,За свои деньги хорошая мышка :)
5,Купил неделю назад. Удобная даже для большой руки. Очень хорошо подходит для игр в шутеры (cs go и тд.) Колёсико, кстати, чёрное, а не серое, как на фотографии.
5,Только что привезли. Мышь, безусловно, отличная в своей ценовой категории. За такие деньги всячески рекомендую.
5,Пользуюсь уже 2 года. Лучший грызун из всех, что когда либо у меня были. До сих пор ничего не расхлипалось, не разболталось/поломалось/перегнулось. Даже надпись X7 до сих пор не затерлась, хотя по 8-12 часов за компом каждый день работаю. ))
5,Мышка отличная. Удобно лежит в руке. Качество сборки на высоте. Предыдущая мышь Logitech M100 была маловата, эта по размерам не намного больше, но удобнее. Конечно перед покупкой лучше в магазинах посмотреть, примерять, но мне повезло, купил наугад.
3,хорошая мыша, сам такого типа пользуюсь уже 2 года, купил внуку...
5,В общем все супер, но: Из-за большого шнура, иногда выключается мышка, так как шнур где-то пережимается.
5,Цена выгодная, возможность программировать кнопки - очень полезна, легкая и очень удобная в использовании. В играх очень и очень хорошо себя проявила. Пользуюсь ею вторую неделю и еще ни разу не подвела. Советую!
5,Пользуюсь сией крысой больше года. Очень доволен. Отлично проявляет себя в играх (CS:GO, Dota 2, Arma2\3). Всем рекомендую!
5,Всё в ней хорошо, клавиш хватает сполна. Дабл клик удобен при работе с папками. Переключение скоростей - хорошая вещь, работаю на четвертой.
5,мишка просто шикарна! Дуже задоволений нею...!
4,Отличный выбор как для геймера, так и для офисного работника.
5,Юзаю чуть більше тижня, недоліків не виявив поки, до того теж була А4 миша (трикнопкова), через роки 2 колесо полетіло, сподіваюсь ця виїздить довше.
3,Была такая же, умер скрол. Решил обновить. Оказалось не такая же. Была A4 Tech XL-750BK ОТЛИЧИЯ: -на рыжей кнопке приятные пупырышки :) -тихо кликает -под большой палец резинка, а не грязе-ямки Не жмите денег и возьмите XL-750BK
5,Толковая мышка.
5,користуюсь більше 3-х місяців, претензій ніяки, тільки трохи матове покриття на лівій кнопці стерлось.
5,замечательная мышь
5,я любитель онлайн игр, мышка просто божественна. очень удобно держать в руке, плюс возможность настраивать кнопки.
5,Отличная мышка для геймеров "среднего" типа (кто очень часто играет но и не занимается киберспортом профессионально).Отличный диапазон DPi где вы можете выставить себе наиболее подходящий. Можно запрограммировать 4 кнопки (4-ая нажатие колесика мышки),этот аспект очень помогает в играх,когда не удобно тянутся от WASD до цифр 67890. Просто удобнейшее расположение кнопки 3xFire (на рисунке оранжевая) что позволяет резко использовать в нужной ситуации. Отлично сочетается с ковриком Х7 Gaming. Удобный и понятный интерфейс пользователя Oscar Mouse Editor.
5,коштує своїх грошей
5,Миш купив разом з пк asus, руку маю велику, миш комфортна, 1,5 роки вже користуюсь на максимальній частоті(10 років миші а4тех на старом пк , ше досі робить), працює на всіх поверхнях лазер починає доставати десь з 5 мм.На дивані з нерівною поверхнею через деякий час буде пригать.Миш падала уже раз 6 з 1 метра точно коли вставав.... живуча.Незнаю нашо брать на батарейках як кабель вже не така й велика проблема , тим більше легша.
5,Пользуюсь дома и на работе. Ничего лучше пока не встречал. Нет лишних наворотов и ненужных кнопок, идеально сидит в руке, гибко переключается чувствительность. Можно задать макросы на любую кнопку. Жаль только что нету такой же модели в беспроводном варианте.
5,Прекрасна мишка, все переключається і працює прекрасно! ;)
5,Мышкой очень доволен. Пользуюсь больше года.
5,Мышка просто восхитительная! Очень нравится, покупайте.
5,Пользуюсь данной мышкой 3 месяца, покупкой доволен. Мышка оптимального среднего размера. До нее тоже была мышка этой фирмы, которой пользовался около 8-ми лет. Правда колесико на мышке не белого цвета, а черного.
4,Есть ли в комплекте диск для установки макросов?
5,Мишка більше ніж повністю вартує витрачених грошей
5,Отличная мышь, идеальное соотношение цена/качество.
5,мышка супер=)
5,Отличная мышь, пользовался Х7 прошлой модели 6 лет, остался крайне доволен, если бы не котейка (провод перегрызла) служила бы еще.
5,хорошая мышка. все устраивает
4,хорошая мышка, но не идеальная
5,за місяць поки що не помітив, хіба особисто для моєї долоні бокові кнопки якби на 5мм ближче до задньої частини було б краще, проте це нівелюється достатнім проміжком між ними і тому при натисканні передньої практично не можливе випадкове натискання задньої.
5,Швидка, зручна, приємна в користуванні, працює добре.
5,По фотографии я посмотрел что колесико прозрачное , то есть скорее всего оно подсвечивается в зависимости какой ДПИ стоит. Действительно ли это так?
5,Отличная мышка не скользкая
5,Отличная мишка реально, она игровая вот что супер оценка 10)
5,Мне нраветца.
5,После долгой и частой работы за компьютером рука не устаёт - хороший вариант дизайна и массы.
5,Была мышь, проработала 5 лет. Нам понравилось и мы купили такую-же. Мышь СУПЕР!
5,Чёткая мышь, очень доволен, всё супер!!!!
5,
5,Прекрасна мишка. Користуюся уже на протязі року, жодних нарікань.
5,Для работы и шутеров лучший выбор за свои деньги. Для ММО маловато кнопок, в остальном супер. Уже давно пользуюсь, первая прожила почти 4 года.
5,Спасибо за качественный товар, и за быструю доставку.
5,Купил на Розетке эту мышь, около 2 месяцев назад. Могу сказать, что это лучшая мышь из всех, что были у меня ранее (а ранее я покупал также, преимущественно Афотек). В этой модели меня подкупила цена, наличие всяких доп. кнопок (не настраивал, ничего не биндил, т.к. оно мне оказалось не надо, просто подключил - и заработало), тканевая оплетка кабеля (у меня все мыши перетирались, надеюсь, кабель этой дольше прослужит), удобный дизайн, и увесистость (внушает доверие), и быстрая возможность смены DPI. Рекомендую к покупке всем, кому нужна недорогая, надежная мышь для работы, и игр.
5,Купил эту мышку позавчера. Сегодня получил то чудо. До этого играл на обычных дешевых мышках. Взял эту в руку и сразу же почувствовал разницу. Мышь немного увесистая, но мне как раз. Привык я к ней где то за 1.5 - 2 часа. Поверхность удобная, создает приятное ощущение того, что мышка из твоей руки никуда не пропадет. Настроил клавиши и макросы. Все отлично работает, сохраняется в память мыши и работает даже с выключенным драйвером. Если вы не собираетесь перенастраивать кнопки, можете даже не устанавливать ПО. Мышь работает без него по умолчанию: Красная кнопка - Дабл клик, боковые - Вперед и Назад. В таком случае, единственное в чем вам понадобится драйвер - что бы узнать текущий DPI, хотя можно обойтись и цветовым датчиком (кнопка переключения меняет цвет) Не понравилось мне только неполнота ПО. А именно, то, что нельзя сменить профили горячей клавишей, а надо открыть драйвер, выбрать другой профиль и загрузить его в мышку. Купил к ней еще коврик на пол стола, мышь по нему просто летает. Мне это, как человеку ранее никогда не игравшему на ковре, весьма доставило удовольствия
4,Отличный грызун. Эта мышка уже давно в списке самых используемых мышек. Многие мечтают о перехваленных Razer или чудовищно дорогих и бессмысленных Rat, но в итоге большинство пользуются мышами линейки A4 Tech X-7. Лучший бюджетный вариант для любого геймера. С прилагаемым ПО не разбирался, базовой настройки хватило на все годы использования этой мышкой. Из реальных минусов - быстро изнашивается, но это скорее мой косяк, так как иногда в пылу баталий мышке доставалось не слабо.
5,Отличная мышь за свою цену. Пользуюсь уже довольно долго, никаких упреков и замечаний нет. Советую!
5,
5,Мышь отличная! Удобная, качественно сделана, работает на ура! Правда вот не понимаю, режимов то 5, а на мышке 6...) Обьясните кто может, спасибо! А остальным, покупайте не задумывайтесь!!!
4,пользуюсь день, дороговата, але думаю довго прослужить.
5,Отличная мышка
5,Рекомендую всім!
3,купила дану мишку не на розетці, а в себе в місті, не прошло року як почала сама відключатись...коли потрясеш тоді знову працює...не задоволена...в самий прекрасний момет підвела...коли гора роботи на компі...
5,Дуже крута мишка. Рекомендую. За такі гроші - найкращий вибір.
3,менял х7 718 на этот х7, что говорит само за себя :)
5,коханий користується вже рік, не жаліється
5,
5,У брата такая уже 2 года, нареканий нет.
4,функционал нареканий не вызывает, качество сборки - тоже. покупал для игр. пользуюсь около полугода, в целом доволен, никаких проблем. единственное - не советую для игры в CS.
5,Своветую кто любит шутеры или CS.
5,Мишка просто БОМБА!!!, швидкість, удобність, грав Far Cry 3 і Battlefield 3 по 6 годин підряд, рука а ні трохи не втомилась, думав купляти безпровідну, але вже рік користуюсь цією і не жалію, хоча в мене рука досить велика.Купляйте не пожалієте.
3,!!!
5,Отличная мышь, удобная форма, приятный на ощупь материал. Очень доволен покупой.
5,Зачёт, мыш супер.
5,Миша на диво класна, але коли я її купив вона не працювала. Мені довелось їхати в розетку щоб її обміняти тепер все добре миша працює як потрібно
5,Сегодня получил!!! Пока всё нормально и даже хорошо!!! Встала без всяких проблем!!! Зачем диск к ней я так и не понял))) Кто знает напишите!!!
5,Только привезли мыш просто отличная
5,Супер мышь!
5,Она больших размеров??
5,За такую цену всем доволен
5,Маленькая удобная и красивая
5,Отличная мышь! Рекомендую. Раньше пользовался Logitech LS1 Laser Mouse.
5,в руке сидит отлично, недорогая
5,данная мышь у меня проработала около 4х-5 лет , вот недавно только порвался провод у нее . ооочень удобная и классная мышь. на замену ей, сегодня заказал на розетке такую же только лазерную)
5,Хорошая модель,качество на высоте,играю в шутеры,привыкал дня два,три.Берите,за эти деньги лучше не найдешь,макросы и прочее очень выручают.
5,мышь супер, отличное качество и характеристики при приятной цене
5,Бомбезная мышка,в Half-Life рву всех
5,За эти деньги-супер
4,Великолепная мышка, для геймеров)
5,хорошая мышь, до этого была за 50 грн тоже афотеч, сравнивать даже нельзя, тут датчик на много точнее!!!
5,Отличная,удобная,симпатичная мышь.Качество сборки тоже классное.Доволен на 100%
4,ролик быстро сдался а так норм
4,Х7 есть Х7. фирма))
5,очень удобная на любом покрытии)
5,Взял на замену умершей. Долго выбирал остановился на этой, пользуюсь пару недель нареканий нет. Боковыми кнопками не пользуюсь.
5,Покупал для игр, очень хорошая мышь
4,Мышь соответствует описанию,но хочу дополнить.
5,шикарная мышь. купил в 2007 году. начала клинить кнопка. буду покупать такую же. шпилю каждый день и ее на 6 лет хватило. бомба.
5,Класс! Всем рекомендую! Брать сразу с ковриком A4 TECH для лучшего скольжения.
5,Лучшая мышь в этой ценовой категории
5,Мишка просто супер вже користуюсь пыв роке немае наіяких зауважень взагалі !!! усім рекомендую !
5,отличная мышка, за эту цену! подключил 20 минут назад.
5,Мы (Я и эта мышь) прошли через огонь и воду я ей пользуюсь около 4 лет точно не помню ну она на каких у меня компьютерах не побывала на каких ноутбуках я прям не знаю вся дребедень устарела и стала не крутой а мышка как новая только пимпочки стёрлись
4,Хорошая мышка короче :) Главное - понять, как её наиболее лучшим способом чистить без потребности вскрывать мышу.
4,мышкой пользуюсь больше года
5,Очень удобная и функциональная мышь
5,Мне нравится. Покупал чтобы играть в Team Fortress 2 и там она очень хорошо себя показала. Да и для обычной работы в Windows она себя хорошо ведёт.
4,Мишка отличная уже 3 года пользуюсь и вот начила подлагивать в кс) но на компе не заметно
5,Мышь отличнейшая!
5,Отличная мышь за эти деньги
4,После обычной мыши будет период адаптации. У меня за месяц так и не прошёл. Мышь кажется тяжеловатой и широко расставлены лкм и пкм. Так как в шутеры не бегаю - не придумал на что прикрутить кнопки. Как нажимать на левые боковые и на другие если практически одновременно - это нужно сильно долго тренироваться - моторика кисти не позволяет пока - мышу просто сносит вправо. Жестковатые клики лкм/пкм, но может ещё разработается...
4,Мышка норм,не глючит не бегает сама по рабочему столу.оч удобная кнопка переключения скоростей))))))
4,Отличная мышка лучше я не видел,только к мышке нужно купить коврик она с ним лучше ездит.
5,Прослужила 6! лет. И не сломалась,но шнур начал слазить,и кабельки были видны,вот я и оторвал кабель =) Классная!
5,Отличная геймерская мышь, удобно лежит в руке, чувствуется движения колесика.
4,Нормальная мышка удобно ложиться в руку серьёзный кабель=) но при закачке софта возникли проблемы пришлось убивать время и шариться по форумам. А так покупкой доволен.
5,Купил эту мышку в 20-го марта 2012 года, очень доволен!
5,В целом мышка не плохая, оп отношению цены. Со стола падала раз 5 - 6, на производство мышки не отразилось ни как! Появилось мнение, что противоударная.
5,Недавно получил мышку. Мышка за такие деньги улёт!)Классно сидит в руке,классный кабель и можно все подстроить под себя.
4,Если вы правша - смело берите за такие деньги.
4,хорошая мыш за данную цену!
