3,Краще A4 Tech G7-4000 взяти.
3,Купил и забыл
5,Купував не на "Розетці", але залишу відгук. Користуюсь уже майже рік, ні разу не ломалась, не глючить. При покупці купив відразу батарейки які можна заряджати(заряджаються довго, але тримають близько місяця).
1,Мышь не понравилась. В сравнении с Logitech слабая. Курсор иногда прыгает и проскальзывает. Часто мышь зависает и не реагирует на движения.
5,рекомендую особенно для мужчин, тк размер имеет значение
3,Впринципе мышка неплохая, если неучитывать мелкие недоработкию
5,Пользуюсь неделю мыша отличная ,работает через всю комнату, на одеяле на ковре на стекле короче на всем. Удобная в руке. Берите не пожалеете.
