5,вчера взял, перед этим была 4 года модель чуть по проще этой же фирмы, мыша как всегда на высоте!
2,Через неделю поверхность мыши просто грязная, я через пару месяцев у тебя в руке кусок грязи который противно трогать и хочется выкинуть. А заниматься каждый день химчисткой мыши у меня желания нету. Почему не сделать гладкую поверхность которая ГОРАЗДО меньше скапливает грязь. Крайне не доволен и больше не куплю данный "шедевр". В замен пользуюсь серией блади. Надеюсь ее не испоганят шершавостью.
5,Покупал на замену старой мышке. Как только принёс курьер, сразу сел пробовать мышку. Приходилось привыкать, ибо очень чувствительная. В играх выдаёт себя на максимум. Например, при игре в шутеры мышка не выдаёт "фризы", очень помогает кнопка "двойной клик", а дополнительные кнопки на мышке заменяют поиск клавиши на клавиатуре. Смотрел много вариантов, но остановился на этой, так как A4Tech мышки славятся своей долгожевучестью. Заказывал 22 января. Уже пользуюсь 8 месяцев. Всё, как и было. Из недостатков скажу то, что стирается надпись X7. Конечно, на работоспособность не влияет, но с надписью выглядит круче. Очень советую эту мышку)
5,Боковые кнопки немного неудобно расположены. Чтоб нажать переднюю, нужно слегка тянуться большим пальцем.
4,миш зделана качествено нескользит приэмна на дотик
5,Мегакрутейшая мышь! Не скользит в руке, плавно двигается по экрану, одни сплошные достоинства. После моей старой оптической мыши Microsoft (в свое время конкурентов у нее не было) просто земля и небо. Мышар очень качественный, рекомендую к покупке.
4,В целом мышь понравилась. Слегка не привычная форма, но в целом удобная. Брал исключительно для работы и со своей ролью она справляется. В играх себя показала тоже хорошо. Особых проблем не наблюдалось. #мояраспаковка
4,Нормальная мыша для своей цены. Пользовался подобной от этой же фирмы около 10 лет. Надеюсь, эта модель тоже будет такой долговечной.
5,І ось майже пройшов другий рік безпроблемного експлуатування цієї миші. Брав для ігор, таких як cs go і т.д, справилась на 5+. Гризун справді добротної зборки та й матеріали якісні, напис Х7 досі не стерся і виглядає як у перший день) Після покупки одна бокова кнопка спочатку трохи залипала, але через пару трійку днів пластик притерся та кнопка більше не турбувала. До мінусів можна віднести маленькі круглі заглиблення під великий палець, там інколи забивається пиль. Але то не критично, бо чистив ті ямки голкою лише два рази. Тому це навіть не мінус, а нюанс)
5,Через три года пришла в негодность левая кнопка. очень часто стала делать двойной клик вместо одинарного. купил на замену такую же только лазерную. хорошая мышка. я доволен
5,Брал давно и не здесь. Первая Х7 прослужила 4 года, потом купил такую же. Единственное отличие было в тканевом проводе с большей надежностью. Из минусов модели - ношу кольцо и под этим местом стерся рисунок наклейки (у меня зеленый) - эстетически не красиво.
5,Мышь работает уже год без нареканий, это не первая подобная мышь у меня, прошлая прослужила 3.5года и всё еще рабочая, хотя боковые клавиши нажимаются очень мягко и не издают звуков. Пол года вожу её в сумке с ноутбуком и работает всё хорошо. Как бюджетный вариант мыши, х7 от А4 качественная и хорошая вещь.
5,Мышь супер. Пользуюсь уже 4 года день в играх каждый день. Все кнопки и колесо работают как новые. Вот только прорезиненное покрытие почти стерлось. Недавно решил протереть спиртом дак оно ещё больше стерлось. Внизу обычный глянцевый пластик. Кто не может найти ПО, оно есть на 4pda ( подписан 7Key_V12.03V20.zip )
5,Отличная многофункциональная мышь за свои деньги. Из минусов только то, что она слегка габаритная, и то кому как
5,провереный временем продукт
5,топ
5,Отличная мышь. Хорошо лежит в руке, красивая.
5,Работает уже 3 года. За это время несколько раз падала, а ей ничего. Кнопки вообще вечные, не хлипкие - о случайных нажатиях можно забыть. Придраться не к чему, лучшая мышь из всех мне известных
5,Работает отлично уже более 2х лет.
5,Мышка работает четвертый год, никаких замечаний нет. В эксплуатации удобна, отзывчива, живуча и дешева.
5,#мояраспаковка Уже не первый раз беру мышку A4Tech X-7- серии и каждый раз оправдывает себя на все 100%. Хорошая сборка, удобно лежит в руке и для меня как раз в меру дополнительных клавиш.
4,Использую эту мышь с начала февраля, никаких замечаний нет.
5,Користуюсь близько року. Мишка чудова!
5,Мишка дуже хороша, брав для роботи та ігор. Для малої руки буде завелика трохи.
5,2-года полет нормальный, как для игр та так и для работы. Шикарная мышка. Но на сегоднешний день можно подобрать модельку по современней !
5,7 лет назад такую модель брал, вернулся к ней)
4,Брал эту мышь 2,5 года назад - получил тогда очень хорошую мышь, до сих пор работает без проблем, всё в ней нравилось. Купил пару дней назад снова такую же - типо из более новых моделей, но в основном мышка такая же. Могу сказать - покрытие мышки супер-неудобное, аж противно держать в руке (никогда не было такого противного покрытия на мышках), оно просто ужасное, слишком маленькие в ширине ЛКМ и ПКМ, провод очень сильно закручивается, но в основном - Выглядит надёжно, провод тоже очень надёжный + в комплекте 8 ножек на замену (в мышке всего 4 ножки, то есть, вы сможете их заменить 2 раза), вообщем - если привыкнуть к покрытию - хорошая мышь.
5,Мишь удобная, за свои деньги - отлично себя показывает!
5,Ежедневно по 12-15 часов - работает что трактор уже больше 3-х лет.
5,Когда примерно появится в наличии?
5,Класная мышь,для своей цены очень даже хорошо
3,Мишь в целом не плохая, но лучше выбирайте серию F с V-treck или 718BK... Я сильно ошибся взяв это чудо, только потому что она была на вид абсолютно идентична с моей бывшей F5 (ну кроме рисунка, он никогда мне не нравился). Сенсор весьма посредственный (пересел с временной мыши за 100 гривен и разницы особо не почувствовал) , профиля переключать можно только из приложения "Оскар" и их всего 2 в одном файле настроек! С первого взгляда это не большой недостаток, но когда попользуешься более удобным продуктом, начинаешь чувствовать разницу. Мой совет - не пожалейте 100 гривен но получите более удобный инструмент.
4,Довольно не плохая мышь. До этого 10 лет юзал совсем другую мышь, по этому неделю чувствовал дискомфорт, а теперь отлично. Не знаю что там за мыши за 1500-2000грн, в этой всё отлично, через oscar полностью кастомизируются все кнопки и чувствительность, хотя я лично всем этим не пользуюсь (не возникало нужды). Хотел купить за 1000+ , но рад что купил эту, удовлетворяет на 110%. Пользуюсь на чистом столе, без ковриков, работает отлично, не дёргается, не заскакивает , не глючит. Старенький логитек прожил 12 лет, современная техника столько не живёт, но надеюсь протянет по дольше.
5,Данная мышь у меня уже больше семи лет, за такую цену лучшую мышь по соотношению цена/качество(функциональность) не встречал. Рекомендую!
5,Хорошее качество за небольшую цену. Сын доволен.
3,за такие деньги пойдет
5,Подарили мне её на ДР 5 лет назад,работает и на данный момент при том что я играю каждый день в World of Tanks и в многие другие игры...Жалоб за это время нету.
5,А що робити, якщо нема дисковода, та й для чого потрібно встановлювати щось із диска, який іде у комплекті із мишкою?
4,Тем не менее хорошая мышь.
5,За 4 года что она у меня - нареканий никаких, работает до сих пор. Если когда нибудь она и сломается - в тот же день куплю такую же.
4,Если брать только для пасивной работы для игр лучше не брать
2,У меня была Х7. Жалоб за 4 года накопилось много. 1) через год перестало работать колесико (при его прокрутке страница на мониторе летает то вверх, то вниз). 2) пытался сам поджать контакты (колесика) и это ни к чему не привело. 3) предыдущие пункты стерпел (просто больше кнопок из-за колесика пришлось нажимать на клавиатуре), а вот это воооообще ! Она начала сама выключаться и включаться через 20 сек. В игрушках это просто убивает... Первый год мышка класная, просто идеальная, а потом все плохо.
5,Несколько дней назад купил, недостатков не увидел очень удобная в обращение.
5,Колесико поскрипывает, что говорит о не самом высоком качестве сборки, но все-равно - 5 из 5.
5,Пользуюсь 2 дня отпишу через 1 неделю если найду недостатки
5,НУ как геймерская у меня первая такая мышка, уже как 2,5 года пользуюсь не подводила ни разу !!!!!
5,Надеюсь брака не будет )))
5,брал себе не замену. старая мышь стала выходить из строя. решил купить 7ку, так как слышал много позитивных отзывов.
5,За такую цену она идеальна.
5,Не помню сколько лет уже у меня такая, больше 2-х точно, до сих пор отлично работает, не облезла. Только немного стерлась прорезиненная поверхность на месте мизинца. Единственный небольшой недостаток - маленькое отверстие под оптический сенсор (4 мм). Не знаю, может это как-то точность повышает, но бывает, ворсинки там застревают, создают помехи и пальцем их достать невозможно. Обычно легкий пчих помогает.
5,Мишка просто супер! Велика - гарно лежить в руці, досить зручна, приємна на дотик. Єдине що ПЗ з оф. сайта качати не зручно - не зрозуміло, який саме файл качати. Також для збереження своїх макросів потрібні танці з бубном, але інфа є в інтернеті, тож розібрався досить швидко. Спасибі Розетці)
5,Отличная мышка которой пользую уже около 5 лет, для игр нормальная мышка с настраиваемым dpi для любых игр, за это время никаких поломок не было.
4,Неплохая мышь для ноутбука. Для игр слишком маленькая. За полтора года работы не подвела ниразу, только шнур подкачал.
2,Эту мышку я покупаю уже 2 раз. первая прослужила около 2 лет , а после этого начало глючить колесико (стераются зубцы на контакте, возможно брак ) . В целом мышка меня устраивала на 100% (крепкая , удобная и надежная) и решил купить такую же. Взял , приехала , открыл и... 1. первое впечатление сразу испортил едкий запах пластика (при покупке прошлой такого не было-100%) . 2.Диска с драйверами в этой коробке я не обнаружил , но это не принципиально ибо можно скачать в интернете да и диск от прошлой мыши у меня остался . 3. Качество сборки... Старая мышка собрана заметно лучше новой .. Такое чувство что решили экономить а4теч , присутствуют щели в тех местах , где мышка 2 годовалой давности была сделана идеально .+Новая мышь с коцкой литья пластика на корпусе. 4. Оптика. Новая мышка ловит стол при поднятии над поверхностью. Это жутко мешает в играх. Старая же себе такого не позволяла . Это связано с различным диаметром отверстия для оптики. Новая-Старая : 3мм:6мм. Как итог : Создается впечатление что мышка купленая в 2016 году это сомнительного качества копия мыши 2014 года .
4,Крутая мышь за свои деньги, кнопка чёрная не как на фото, сама мышь шершавая очень удобно не скользит
4,купил почти год назад, впринципе доволен, в кс поганять можно :D тяжеленькая (как я люблю), приятно удивил обшитый провод и горящая разными цветами кнопка dpi :) Единственное, что не нравится, внешняя структура шершавая, поэтому грязнится сильнее. Кто подскажет как вы чистите свои мышку/клавиатуру?
5,Отличная мышка за свои деньги!
4,Взяв собі на заміну X-5, дизайн сподобався! Більше нічого не можу сказати. Буде видно через рік роботи!
5,Мышка просто монстр, пользуюсь 7 лет, при этом активно играю в игры. Когда сильно бомбит луплю ей со всей дури по столу, а ей хоть бы что. И так реально 7 лет.
5,Классная мышка за небольшие деньги. рекомендую.
5,Отличный товар!
5,Задоволений що не став економити і купувати щось дешевше. До цьої мишки навіть звикати не треба, навпаки після неї на роботі користуватись дешевими дуже важко. В WOTі виявила себе пречудесно. Громада додаткових налаштувань задовільнить будь якого геймера. В минулих відгуках помічав що пишуть про туге колесико, але з ним все в порядку. Шнур плетений, посилений, курсор як заворожений її слухає. 4 пари запасних ніжок коли небудь стануть в пригоді. Диска з ПО в ньому не було, хоча на оф сайті було про нього заявлено, але з того же сайту за секунди скачав необхідну програму (Оскар) для більш тонких налаштувань в тч будь які макроси.
5,Отличная мышка за такие деньги. Брал 1,5 года назад, работает нормально без ни каких конфузов.
5,Пользуюсь мышкой уже 2 года.Работает так же как и в день получения.
5,Мышку купил 2 года назад, вот решил отписаться. Работает почти идеально, поменял уже 2 коврика х7, а мышка еще живая)) единственное что произошло, это колесико при нажатии стало через раз реагировать, заметно в браузере, больше недостатков нет!
5,Пользуемся очень активно мышью, практически круглосуточно. Довольны все, кто играет. И я, и сын и дочь. Очень нравится то, что можно выбирать скорость мыши. Для нас с сыном быстрая, а для дочери - поменьше.
3,Мышь в целом не плохая, но мышь которая была перед этим (A4Tech Bloody V5) явно выигрывает почти по всем параметрам, жаль что у bloody сломалось колёсико которое несколько раз чинил но оно всё равно ломалось раз за разом. Решил взять мышь исходя из комментариев на розетке. Как доставил курьер мне мышь и первая эмоция это разочарование :) Буду надеяться на большую долговечность чем у её предшественника.
5,Пользуюсь сейчас A4Tech Bloody V8MA Activated Black но тоскую по старой...
5,За год работы с мышкой недостатков не выявил
5,Я даже не знал, насколько удобная и точная мышь может изменить работу за компьютером! Очень удобна в руке. Макросы настроенные для рабочих программ просто блеск! В онлайн стрелялках сразу рейтинг пополз вверх. (мышь у меня уже год)
4,Мышь супер.Если для игр в жанре rpg то её хватает за голову.Я сам кс го играю и покупал под эту игру и я доволен но только одна проблема которую я указал.
5,Купил год назад,покупкой доволён,играю очень много в шутеры,никаких проблем не было.Апнуть глобала в кс го вы точно сможете.За год активного использования недостатков нет,берите,не пожалеете.
5,В характеристике написано все правильно.А сам уже год пользуюсь все работает.Доставка 2-3 дня.Рекомендую.
5,A4TECH представляют нам малобюджетную игровую мышку X7 X-710BK.Она отлично лежит в руке,не соскальзывает.Мышь имеет 5 режимов регулировки скорости 400/800/1200/1600/2000.Присутствует 7 кнопок:ЛКМ,ПКМ,среднее колёсико,2 боковых,тройной клик,кнопка регулировки скорости.Мишь реагирует на любое прекосновение.Всем геймерам рекомендую.
5,Кто хотел покупать, смело берите!!!! Она долговечная P.S мышка частенько падала и все равно работает)
5,Переназначаються клавиши с помощью офф. Софта
5,МЫШКА КЛАСС, РЕКОМЕНДУЮ .
5,Отличная мышка с поддержкой записи макросов
