5,Прошлая мишка, она и сейчас рабочая: A4tech WOP-35, причина покупки новой: левая клавиша клацает очень часто вместо одного-два раза. А эта мишка очень хорошо её заменила. Доволен.
5,Очень удобная мышка
5,мышь - однозначный вин
5,для любителей шутеров просто супер
1,Купив цю мишку - і поки що зовсім не задоволений. Надмірна чутливість та "робота на будь-яких поверхнях" призводить до того, що мишку час від часу кидає (в моменти прицілювання по пунктах) і влучити по дрібних потрібних пунктах стає важко. Користуюсь уже 2 години, а рука так виснажилась, ніби користувався мишкою 20 год. підряд не зупиняючись . В старих версіях покриття корпусу було зручніше, як на мене. Можливо ще звикну. Плюс до всього іншого мишка надто легка. На хорошому коврику вона здатна самовільно рухатися навіть тільки через розгинання згинів власного кабелю. Можливо вона ще "впрацюється", але це перший раз коли мишка поводиться не так як годиться із самого початку.
5,мыш классгая играю в квейк четкость передвижения супер очень удобная програмка оскар и переключатель дпай. всем советую. смысла невижу брать мышки за 500 гр. возьмите лучше ету характеристики одни и теже практически. всем советую ету мыш. 710 и 748к разницы кроме формы невижу никакой абсолютно идентичные характеристики.
5,Мышь супер.2 года пользуюсь и ни каких проблем.
5,Использую почти год, все просто супер!!!
3,Вот вам моя ложка дегтя в эту бочку с медом. Начну со шнура. Зачем мышке плетенный шнур от утюга? На нем можно повесить кого угодно, он выдержит, но на столе он жесткий и не удобный, к тому же когда шнур трется об угол стола, такое ощущение, что ножовка пилит этот угол. В моих скромных пониманиях, шнур должен ходить не заметно по поверхностям и не шуршать и не мешать. Потом, мышка на фото выглядит солидно, в жизни тоже ничего, но на ощупь ты понимаешь, что не так все радужно, неприятная на ощупь пластмасса. После предыдущей мышки, той же фирмы, у которой было прорезиненное напыление поверхности, которая была очень мягка и приятна на ощупь, эта ощущается убоговастенько, хотя та, была дешевле. И последнее, у этой мыши очень громко клацают кнопки. Мне сегодня было не удобно перед женой утром клацать, когда она еще спала. С предыдущей мышкой, такой проблемы не было. Вот так. Я бы не сказал, что она мне вообще не понравилась, но и не могу сказать, что этот девайс стоит свои 20 баксов.
5,Мышь отбегала уже 3 года на работе, где компьютер используется посменно круглосуточно и никаких глюков.
5,мыш просто класс я уже год с ней не разу не подводила столько раз падала и все ровно работала
5,Мышь просто бомба! Пользуюсь уже почти год! Еще не подводила. Ну просто супер!!!
5,мышь просто отличная хорошо подходит для геймеров
5,вчера взял, перед этим была 4 года модель чуть по проще этой же фирмы, мыша как всегда на высоте!
5,Мыша отличная!
5,Отличная мышка, юзаю уже 4 год...и вот только недавно переломился шнур возле самого штекера... а ремонт 80 грн (друзья говорят : "Да купи себе новую и не парься")...но я всё же сделаю и думаю она мне ещё прослужит ещё хотя бы столько же ))) Мышка классная очень рекомендую !
5,Очень класная мишка!!!! Мне очень понравилась клевая скорость!!!!!
5,мыша супер купил и не жалею ещё клавиатуру такую хочу.
4,Мышь отличная, и дизайн, и эргономика, и функциональность - всё на уровне. Вот только провод тонкий слишком - уже на второй такой перебивается :(
5,Купил сегодня за 220 грн в фокстроте, мышь просто мего, сижу и радуюсь, жаль что не в розетке покупал так как нужно было срочно мышь купить
5,Офигительная мишка, а самоё лучшеё то что есть регулятор скорости курсора
5,мышка очень хорошая,плавная.Всем рекомендую
5,Отличная мышка, плавная, быстрая, четкая. А шершавый пластик мне, например, понравился, и резинка под большим пальцем тоже порадовала.
5,да, мыш четкая! очень четкое и плавное передвижение. если кому-то поможет в выборе, то это, кажется, как раз тот "недорогой" вариант
5,Всем рекомендую...
