5,Хорошая мишка, рекомендую, прослужила 6 лет, и нечего не сломалось.
5,Хорошая стандартная мышка. Драйвера нашлись сами после подключения. Удобная и простая. Как раз то, что нужно для работы каждый день.
5,Супер мышь для офисе. Пробовали разные, но эта просто идеальна
5,Стандартная мышка. За такие деньги - лучший вариант.
5,Доволі часто міняв миші через те що часто ламаються, були різні дорогі і не дуже, доки не потрапив на дану модель, працює ідеально і без збоїв, як що вам потрібна не дорога та надійна мишка, це саме те що ви шукали
5,за такие деньги-отличная!
5,Отличная мышка для маленький "геймеров" а так же для работы за компьютером. Рекомендую мышку всем!
5,Отличная мышка, качество превосходит цену в несколько раз
5,Рекомендую для покупки
5,Мышка клас скажите а драйвера нужны или нет
5,За такие деньги-отличная мышка.
5,Хорошая мышка, в офис, для дома конечно лучше взять что то из игровых.
5,За свои деньги нормальная мышь
5,Пять с половиной лет назад, покупал себе новый комп, собирал мне знакомый, работающий на складе компьютерного магазина. Он же и посоветовал и дешевых эту мышку... До сих пор она в рабочем состоянии, за это время стерлась надпись (которая под ладошкой) и задние ножки почти полностью стерлись (серединки на них уже отклеились), а передние ножки до сих пор в полной боевой готовности... В моей руке лежит очень удобно, но если у вас маленькая женская ручка, может не подойти, т.к. она достаточно продолговатая (см. характеристики)... Для меня эта мышка 10/10, единственное чего не хватает, так это дополнительных кнопок, но за эту цену, такого не найдешь...
1,управлять курсором одно мучение. надеялся на более менее хорошую мышь. так получилось так. что гораздо дешевле мыша оказалась лучше этой. курсор тугоуправляемый. Очень плохая, хотя повёлся на положительные отзывы. думаю вернуть
5,История - 5-ти копеечная. Купил 2 года назад примерно у девушки через пару домов оказалось живет, по цене как сейчас 2 пакета молока! Реально, чистый "японец"))))) Я уже жду, не дождусь,- когда она навернется... хочу без шнура! Вот и начал искать, а в руке эта не убиваемая штука)))) Падать помогаю в последнее время ей, а ей хоть бы что... И в КС эймы отличные с ней и дотку и работа по 10 часов в сутки ... Эргономичность на высоте. Переписал параметры даже !! АХАХААХ Смотрите, покупайте на свой страх и риск, ведь есть огромный шанс , что она останется НА ВЕКА!
5,За таку ціну годі чекати кращого...
4,звичайна проста миша, яка виконує свої функції
5,Шикарная мышка, пользуюсь уже больше 5 лет знакомые и соседи поменяли уже кучу мышок, а у моей ток название фирмы стерлось)) обожаю ее, очень удобная и простая) советую)
5,Хороша мишка за свою ціну. Купував племіннику то не скаржиться. Сам користуюся схожою моделлю вже майже 5 років. Рекомендую.
5,подключил и сразу в бой, не каких проблем
5,.
5,работает отлично. хорошее качество!
5,Отличная мышка, удобная по руке, быстрая. Мне понравилась.
5,Хорошая и качественная мышь.
5,быстро отправили. документы есть. гарантия проставлена. мышка легкая. рабочая. такая клавиатура у меня уже 6 лет. надеюсь и мышка тоже не подведет)
5,5 лет радует.работает как часы.доволен как слон
5,Захотілося звичайної робочої мишки (класики) бо вже дістали бездротові миші в яких в самий непідходячий момент сідають батарейки. Вібір впав на цю мишку оскільки був досвід користування мишами цієї фірми ще без лазеру. Мишка як мишка працює і цього досить.
5,Рабочая лошадка для тех кому не важны понты при описании друзьям, какой у него крутой манипулятор.
4,Нормальная мышь среднего качества. Шумно клацают кнопки, но за такую цену сойдет.
4,Бюджетный вариант для офисной работы
3,Такие мышки стоят у нас в компьютерном клубе. Они простые, как "кирпич", неудобные для работы, но служат уже около 4-х лет. Очень надежная модель.
5,Купил три года назад, бил ее очень много, и до сих пор целая.
5,Адекватна ціна/якість.
