4,Качественная мышь, в руке лежит приятно, достаточно удобно калибруется под любую поверхность, заряд держит достаточно долго. Покупкой доволен, особенно, учитывая скидку, которая была на момент покупки.
5,Крута безпровідна мишка, реагує швидко, в руці приємно лежить. Вигляд в неї просто бомба. Світиться, є 3 режима підсвітки. За таку ціну важко найти щось краще. Для шутерів підходить дуже завдяки свої режимам таким як: ks, ks go, Call of Duty і тд. #моєрозпакування
1,Прошел ровно год с момента покупки, и вот мышь перестала заряжаться, и вовсе не определяется даже при подключении через USB. Обидно, и мышь уже не гарантийнтая...
5,Заряжается быстро. Заряд держит довольно долго. Активировал тоже без проблем.
4,Мышка нормальная, но через 2 года появился двойной клик. Также неудобно, что часто приходится её заряжать( раз в 3 суток). Кабель вовремя зарядки сильно мешает, зарядка длится 6 часов.
4,Пользуюсь мышью два года. Отлично лежит в руке, качественная сборка, превосходный внешний вид, огромная вариативность настроек в ПО. Но при этом есть свои недостатки. Первая мышь помахала мне ручкой через 10 месяцев использования. Я так и не понял, что с ней там случилось, но она начала дико глючить, и вести себя неадекватно. Принес по гарантии, поменяли на новую (розетке большое спасибо, все прошло отлично). Однако даже до поломки было заметно, что аккумулятор начал садиться в два раза быстрее. Сейчас новой мыше год и три месяца. Работает то она исправно, но аккумулятор опять начинает сдавать. Если в первые месяцы он держал заряд около двух дней при высоких нагрузках, и три-четыре при невысоких, то сейчас его хватает часов на 6 активной игры при полном отключении подсветки мыши. Гарантийный срок прошел, и походу надо покупать новую, так как поменять батарейку нельзя, она встроенная. Буду, наверное, брать V7MA, так как очень уж привык и полюбил серию "Bloody". Ну и хотелось бы заметить, что заряжать её хоть и быстро, но она не будет работать от USB провода. То есть передатчик втыкнут должен быть всегда. Как-то это не логично, так как в удлинителе (который есть в комплекте) стоит именно маленький USB передатчик, и от этого же удлинителя (по логике производителя) нужно заряжать мышь. В итоге передатчик идет на системник, мышь заряжается, а передатчик в системнике и забывается. И как результат батарейка гаснет быстро, так как до системника расстояние выше. Короче бесит.
5,По сравнению с другими беспроводными мышами очень слабо держит заряд - дня три активной работы, в то время как мыши на пальчиковых батарейках могут и год проработать. Но за эргономику и вес можно простить этот недостаток. Что касается гейминга, то не в курсе, хотя в дотан ракую иногда - все отлично. Брал исключительно ради металлических ножек, которые вечные, в отличие от обычных тефлоновых, которые стираются за месяц.
5,Ребят в новой поставке мышей( нет коврика для протирания и наклейки на разных бумажках) убрали вонь пластика и передняя ножка теперь на одном уровне с остальными. Покупал брату на НГ( у меня рейзер нага ) и остался очень доволен.
3,Пользоватся было очень удобно. Мышь очень нравилась. Ровно месяц. Ровно через месяц она перестала заряжатся. Ведь вход для зарядки там держится на абсолютном чесном слове, а учитывая, как туго микро-юсб штекер заходит туда, не странно, что он повредился очень быстро. Читал в интернете, у многих такая проблема была. Разбирается мышь ужасно, так что буду покупать себе новую скорее всего. Но весь этот месяц мышью был очень доволен: приятная на ощупь, никаких заметных задержек, немного непривычный, но всё же довольно удобный дизайн. Мышь отличная, но совершенно не надёжная.
4,Пользуюсь всего несколько дней и очень надеюсь что вонь от пластика выветрится: воняет не только сама мышь, но и ладонь. Вот откуда название Bloody Hand - химия на мышке разъест ладонь и будет действительно кровавая рука :) Нареканий по работе самой мыши пока нет. Софт не очень понятный. Судя по отзывам многие не разобрались как менять чувствительность - я и сам не сразу нашел как это делать: двойной клик на клавишу "1" на мышке, потом скроллом вверх-вниз для изменения чувствительности (лучше запустить программу чтоб видеть изменения) и затем снова на единичку чтоб сохранить изменения.
4,Классная мышка, заряда хватает примерно на неделю, использую примерно по 8 часов в день. Очень классное скольжение по столу, такое чувство что просто по воздуху руку водишь.
5,Т.к. я любитель поиграть на пк + работаю в IT, то мышь использую регулярно, поэтому заряда особо не хватает, 1-2 в неделю заряжаю :)
5,По началу бесили угловатости и аромат нового китайского пластика, а уже под конец дня был покорен этим чудом техники, оказалась очень удобной в сравнении с Х7. Грызун отличный!
5,Отлично!
5,За полгода пользования не 1го минуса. Мышка просто идеальная - эргономичная, быстрая, регулируемая, супер.
5,Отлична мышь, для игр самое то! Красивый дизайн, в руке лежит интересно.
5,Давно хотела такую мышку, летом дождалась скидок и купила. Мышка оправдала свои ожидания. Многофункциональная. Одно но, покупайте к ней лицензионное по.
5,берите не пожалеете!
4,В целом неплохая штука, но у меня наверное даже телефон на андроиде реже заряжать надо, чем эту мышь... Так-же вот спустя 3 месяца перестала включаться( Завтра понесу...
3,Ужасная мышка. Не знаю какой формы руки у тех, кто пишет, что она удобная. Из за симметричности мизинец и, возможно, безымянный ( зависит как держать мышку ) со временем начнут болеть да так, что у вас пропадет всякое желание играть в игры, ибо у правой части мышки такой же резкий изгиб, как и у левой, в итоге ощущения, будто держите кубик рубика, а не мышку. Мышку заказывать не стоит. Брать только в магазине предварительно проверив, что подходит по размерам вашей руки. Для меня, например, мышка оказалась слишком большой, чтобы двигать её пальцами и лишком маленькой, чтобы двигать её целой рукой. Для маленьких рук тоже будет неудобно, разве что у вас есть какая-нибудь подкладка под кисть, ибо мышка выше чем многие другие модели. Металлические ножки может быть и износостойкие, но если вы двигаете мышку всей рукой, то мышка двигается явно туже, чем остальные, даже мышки с резиновыми ножками. Может быть спасет пластиковый коврик, но какой здоровый человек будет юзать пластиковый коврик к игровой мышке? В общем перед тем, как брать, советую на все 100% удостовериться, что мышка вам подходит.
5,Отличная мышка. Запаха никакого не заметил , рука лежит удобно , сделал калибровку под поверхность и все гуд .
5,В целом мышь отличная претензий нет. Сначала сильный запах пластика, но спустя неделю не чувствуется, если не подносить к носу конечно.
5,советую)
4,Купил 2 недели назад, вроде не брак, но не на всех поверхностях можно пользоваться.
4,Все классно, но батарея.....
