1,Пользуюсь с конца февраля 2016г. мышь ужасная... Очень долго привыкал к форме. Боковые кнопки крайне не удобные ля пользования. Через 8-9 месяцев на мышке появился двойной клик. Не советую брать, лучше что-то из серии x7.
5,Покупал мышку несколько лет назад, уже не помню точно. Я люблю компактные мыши, т.к. работаю на ноутбуке и много перемещаюсь. ZL5 такой не является, оказалась широковата. Привык быстро, пальцы удобно ложатся на кнопки. Любители длинных мышек вероятно со мной не согласятся. С ПО проблем нет, один раз настроил и забыл о нём. В интернете много мануалов как по официальной настройке, так и не совсем. Мышку, к сожалению, ронял много раз, из-за чего она уже не сохранила товарный вид, но всё ещё круто выглядит. Вообще очень доволен мышкой. Работать, а особенно играть одно удовольствие.
3,Покупал в 2014 году на розетке , только с активированым софтом . На второй год использования кнопки начали люфтить , также были частые случаи случайных нажатий бокового джойстика так что пришлось отключать софт , покрытие начало сходить .Сенсор не подводил ,работал на ура. Думаю свое эта мышь отработала.
1,1. В описании написано, что Core-3 розблокирован, НЕТ! 2. Скачал официальное ПО 6-й версии на официальном сайте и оно не видит мышку( не показывает ID, не меняет настройки) но сама мышка работает. Подскажите что делать, покупал A4tech думал все будет OK, а тут всьо плохо!!
5,Отличный дэвайс, довольно большая не подойдёт для маленьких рук.
5,Рекомендую, потому что недостатки есть, но они почти бесполезные, кроме правой руки, уже 3 месяца играю на ней (я геймер, и лично рекомендую, потомучто у меня было очень много мышей, но эта самая лучшая из них) За 3-4 месяца ничего не сломалось, не случилось плохого, всё хорошо, главное что для такой дешевой мыши, предназначеной для левой руки ещё и геймерской, это самый лучший вариант для леворуких геймеров (как и я)...
4,Отличный девайс, красивый и удобный. До этого юзал Logitech G602, так вот, эта мышь её достойно заменила, к размеру даже не нужно привыкать.
3,зробіть нормальний функціонал ПО Bloody і буде щастя)
5,Поки що задоволена
5,Уже 2 недели прошло после покупки, могу смело рекоммендовать. Все параметры на высоте. Много программируемых профилей. Покупалась для игр и работы в фотошопе. Отлично себя проявилах в обоих случаях. Настроил кнопки под себя и готово. Правда пришлось немного поковырять програмку пока понял в каком из профилей можно задействовать все кнопки. Им оказался самый первый:) В самой програмке очпнь много надстроек. В общем можно настроить под любой каприз. Доволен!
4,После недели использования данной мышкой начал наблюдать натертости которые появились на основных кнопках (правая, левая) с учетом того что они прорезинены или точнее с резиновым напылением. На ощущение конечно приятные но посмотрим на сколько их хватит. Покупал не Актив. версию поскольку нету смысла переплачивать активация бесплатная если мозги работают. Туповатое ПО в особенности подсветки. Слишком большая разница в конечном дпи 800, 1000, 1200, 1600, 8200- не реально использовать если только у вас монитор не на 4к расширение. Цена завышена. Мой совет купите себе лучше http://hard.rozetka.com.ua/a4_tech_f7_shake/p245713/ тоже самое + с доп. весом и стоит в 2 раза дешевле.
4,Брал как дополнение к Mad Catz R.A.T. 5, как домашний вариант. С полным ПО рвет ее в пух и прах.Мышь понравилась, ка по цекне так и по компоновке. Боковые кнопкы удобно нажымать еси растояние от фаланги большого пальца порядка 45мм, С стрелочкой вверх немного проблемы иногда задеваю верхний тилт, привык. Без полного ПО фунционал сильно ограничили. Хоч макросы через Alt,Ctrl... оставили.
5,товар соответсвует описанию
4,Покупал на Розетке. Очень красивая и качественно выполненная мышь! Soft-touch покрытие очень приятное на ощупь, да и мышка надежно лежит в руке, не выскальзывает. Довольно удобная! Немного привыкать пришлось только к расположению боковых кнопок считаю их расположение не очень удачным решением!
5,Вполне достойная мышь,брал в розетке.До этого была A4-tech x7 747h,но пришла пора менять.Брал для игры в WOT.И покупкой доволен!Всем рекомендую!
5,Отличная мышка! Воткнул в компьютер как только приехала, и моя предвзятость к А4 унесло далеко-далеко.Удобная, не выскальзывает, хороший сенсор. Раньше пользовался Mad Catz R.A.T. 5, так вот не нужны эти крысы! А4 удобнее, смышленее, да и в конце концов дешевле.
