5,Отличная мышка - всем рекомендую.
3,мышка по сути для нетребовательных пользователей, ну и у меня ровно год отработала и начались приколы с выделением
5,Все супер, мишкою дуже задоволений, один лише маленький нюанс, як на мене хотілось би тугіше прокрушування колеска, але вцілому все супер, на роботі абсолютно не впливає
5,колёсико на любителя, с лёгким тихим вжух - и мне всёравно когда работаю.
5,Как по мне одна из удобных мышек. Обычно мышки сильно плоские. То есть между верхней частью мыши и ладонью зазор. А эта чётко под ладонь ложится.
5,рекомендую
5,Пользуюсь около полугода, доволен всем.
3,Покупали полтора года назад, все еще работает :)
5,Покупала 3 июня 2015 года, работала просто превосходно, а начиная со вчера ( 02.03.15) марта главная кнопка потеряла интенсивность, копировать текст не возможно, постоянные дабл клики. если вы так же и работаете с текстовыми документами необходимо чрезмерная внимательность т.к. замена текста происходит просто не заметным для вас взглядом. Буду теперь покупать новую. Но такую точно уже не куплю :( в жаль, в остальном было отлично
5,Очень удобная игровая мышь, пользуюсь практически месяц.
5,Красивая удобная! Все нравится.
5,Красивая удобная! Все нравится. Сдохла х7 решил купить на замену (Если умрет и эта то не жалко) Пока все супер. Работает как положено. Время покажет
4,Соответствует своей цене.
4,доволен
3,Друзья, мышь отличная за эти деньги, прекрасно лежит в руке, за эти деньги - отлично. Большой минус для меня и имейте это ввиду, те, кто хочет купить ее для работы в среде 3D пакетов, или программ для дизайна - это то, что стандартное ПО идущее в комплекте, предлагает скудный набор функций для программирования доп. кнопок. Типа alt+tab, копировать, впред-назад в браузере. Особенно убил макрос из списка "найти всех свободных рабочих в варкрафте")))) Ну и такое прочее. Запрограммировать CTRL, SHIFT, или ALT, что жизненно необходимо тем. кто работает в 3D и хочет оптимизировать работу. имея эти кнопки под большим пальцем, что очень удобно - не выйдет. Имейте это ввиду. Искал стороннее ПО для программирования и это либо сложно и нужно кодить, или, тоже самое: игровые макросы и сочетания клавиш, больше полезные для работы с текстом. или интернет-серфинга. Короче, лично для меня, приобретение оказалось бесполезным, для тех целей, что я преследовал. Просто купил удобную и недорогую мышь. X7 с ее Oscar Mouse Editor, где можно программить любые клавиши не превзойдена, придется так и работать на ней, а эту забрать домой, или подарить, какой-нибудь блондинке. Но, мышь хорошая, повторюсь ,просто очень ограничен функционал тупым ПО. Если кто -то знает, как обойти это, напишите.
5,Хорошая мышь. Удобная
4,Вот только что забрал с пункта выдачи. Мышь очень удобная, с регулировкой чувствительности и индикатором.
4,За такие деньги - просто отличная мышь! Я бы не сказал, что она уж прям так сильно воняет. Слышно только когда поднести прямо к носу. Хотя может быть мне попался удачный экземпляр))
4,За дизайн +, но запах пластика толи каучука не радует, оценка 4
5,розрахована під велику долоню, жінкам, дітям може бути не комфортна
5,За такі гроші, це найкраща мишка. Раджу всім, не пожалієте.
5,отличная мышь за такие деньги, удобная, хорошо лежит в руке, все четко работает (немного хрустит колесико, но на работу не влияет). Удивили драйвера в комплекте, за такие деньги не ожидал)
3,Мышь ужасно воняет паленой проводкой. Первый день даже пришлось выносить из комнаты на ночь. Но через дня так три выветрилось, теперь можно пользоваться)
4,если бы не было тех минусов которые я перечислил, то мышка была бы просто идеальной, учитывая её цену. Как для меня слегка великовата, до этого у меня все мышки были на порядок меньше, но это уже недостаток возможности выбора товара в магазине, так как на витрине этого товара не было, по этому не мог понять на сколько она удобная для руки). И как писал парень, было бы не плохо сделать место под мизинец и безымянный пальцы.
5,Мышь хорошая. Неплохой дизайн, приятный материал. Удобно работать. с Windows 8.1 x64 работает нормально.
4,Хорошая мышь. Удобная, работает на всех поверхностях.
5,Мышь прекрасная. Покупаю ещё 2 ))
