4,Для такой цены отличная мышь!
5,Хороший товар, претензий нет
5,Гарна миша економ класу. Єдине що вона негучна, без клацання - хоча для декого це навпаки буде перевагою. Але після миши яка клацала - працювати з цією трохи незвично. Рєагує дуже добре на клацання.
2,Поганий сенсор який на 1000dpi ніяк не тягне через що рух курсора по екрану стає непердбачуваним.
5,Покупала больше года назад. Работает до сих пор без проблем. Никаких нюансов. Супер мышка за крошечные деньги.
1,Практически на любой поверхности курсов перестает двигаться или перемещается на крайне малые расстояния. Использование превращается в испытание на прочность нервной системы. Конечно. я не ожидал чего-то серьезного за такую цену, но двумя мышками, что были куплены пользоваться не возможно. Буду возвращать.
4,Спасибо за быстрое, оперативное, качественное обслуживание.
5,Мышка очень шустрая, работает прекрасно, торможений нет и стрелку ловить не приходится) Всем рекомендую. Тем более за эти деньги) Доставили быстро и без повреждений. Розетка спасибо!
4,Нормальная мышка для переносных систем или эпизодического использования
5,Маленькая, шустрая мышка для ноутбука.
5,Работает прекрасно. Цена и качество отличные. Кому нравятся маленькие мышки - это для них.
5,очень удобная, шустринькая мышка с красной подсветкой
3,Ціна-якість нормальна. Якість "так собі". Уже майже рік працює.
4,расходный материал !
4,Брали мужу. Пока не жаловался! :)
2,За такую цену этой мышке можно простить всё, но не её размеры. Туннельный синдром через месяц пользования обеспечен! Она слишком маленькая по сравнению с другими (большинством) ноутбучных мышей и от того крайне неудобная. Интересное замечание! У меня на рабочем матовом столе с декоративными шероховатостями она работает лучше чем на листе бумаги.
5,Прекрасно работает. Не хуже дорогих аналогов. Цена=качество
2,купили 15 шт. з них 7 шт. возврат. 2 - курсор мертвий, 1 - дві окремі половинки, 1 - не працює колісчатко, 3 - позиціювання преривчасте
5,Низкая цена.Быстрая доставка.
5,Самое что есть лучше в своём классе цена и качество здесь супер
5,Мышка отличная но для женских ручек.Дочка очень довольна.Розетке спасибо!
3,Пока не пришёл товар. Есть вопросы у продавца: 1) Какой срок службы? 2)Как она выглядит в руке? Вот и всё=)
5,Нормальная мышь за эту цену. Если у кого возникли проблемы обращайтесь сразу в сервисный центр. Я поторопился с первым отзывом, мышь работает. Подключил в другой юсб разъем и мышь заработала, работает второй день и никаких проблем в работе не заметил. Не торопитесь с отзывами. Розетка как всегда на высоте. Спасибо!
1,Сервисный центр находится в Киеве, отправка за счет отправителя, мышь обойдется при обмене в цену около 100 грн. Обидно, ну да ладно... Оставлю себе нерабочую мышь на добрую память о Розетке. До сих пор все заказы на Розетке выполнялись на высшем уровне, но увы бывают исключения...
5,это самая не удобная мышка которую я покупал,на коврике не работает,щелчка не слышно при нажатии клавиши,маленькая,может она и удобная для детской ручки но для взрослого человека не годится или только для просмотра фильма но для роботы это катастрофа и беспокоит эта подсветка как показывает мой опыт обычно такие яркие и дешевые вещи на месяц но за такую цену можно купить ящик мышек и менять.
5,За такую цену, хорошая мышка, классно светится, нормально работает)))
2,Мышка тупит с момента подключения к компьютеру. Курсор зависает либо дерганый черезчур. В плане внешнего вида всё отлично, но мышь попалась совершенно не шустрая. Постоянно вынимать и вставлять обратно нужно в разъем, чтоб работала. Цена отвечает качеству
4,Нормальная мышка с оптимальной длиной шнура для работы с ноутбуком.
3,Я не задоволена мишею. Так, вона дуже бюджетна. Але дуже легка, а провід товстий, що створює незручності у використанні. Працює нормально не на всіх поверхнях. На килимку для миші не працює - стрибає по екрану. Довелось приклеїти шматок білого паперу, на папері - біль-менш нормально. До цього була також бюджетна миша, вона була кращою набагато. Плавних рухів курсора з нею не виходить навіть на білому папері, але для серфінгу в інтернеті підійде. Кнопки гучні (що й не дивно за таку ціну), коліщатко нормальне. Матеріал миші - простий пластик, нічого особливого. Купувати раджу лиш якщо треба ну дуже дешева миша. В іншому разі краще переплатити в 2-3 рази, але купити щось таке, що не дратуватиме. Зауваживши усі "за" і "проти", зійшлась на оцінці "Нормально".
5,Мышкой довольна. Хорошо работает и очень отзывчивая. Мне всё нравится. Отдельный супер плюс - ЦЕНА!!! Всем рекомендую.
3,Не очень удобная мышь. В первую очередь, из-за размера. Вторая причина неудобств - колёсико. Я работаю с 3д-графикой и мне важно, чтоб колёсико работало. А оно жутко нестабильно. То работает, то нет.
4,Мышка немного маленькая, но работе это не мешает. В общем товаром довольна.
1,купила 2 штуки каждая проработала по неделе.
5,У меня такая-же только от фирмы Х (ноунейм Китая), везде они одинаковые... Была сессия, срочно надо было купить мышь, старая накрылась...долго думал, брать-не брать... ... решил рискнуть! Были разные у меня, все приходили в негодность, глючили, а эта чудо какое-то за смешные копейки... Изначально очень неудобно было с ней... она маленькая... но спустя некоторое время я полностью адаптировался.
4,Нормальная и не дорогая мышка, работает.
3,ЗА ТАКУЮ ЦЕНУ , ПОЙДЕТ
4,супер
5,класс
3,Немного "деревянная" на отклик. Брала на редко используемый ноут, для работы не советую.
4,Хорошая, небольшая, компактная мышка. ничего особенного, но и ничего ужасного. Единственное, что немного напрягает - это её резвость. Сильно скачет по экрану. Скорей всего это из-за её легкого веса
5,заказала для школы в компьютерный класс... работают просто супер по сравнению с теми что там были....
2,Купил. Остался не доволен. Брал для ноута. Плохой глючный лазер, мышку ведеш в сторону первую секунду не реагирует, потом рывками. Вес грамм 20, в руке не чувствуется. Возвращать не буду лишь по тому что игра не стоит свеч из за дешовой цены мышки. Оставлю как запасную.
4,За такие деньги мышка себя полностью оправдывает..
5,Нормальная мышь за такую цену. светит очень красиво имне нравиться. В руке лежит удобно. Сделано качественно. К ноутбуку подключилось и дравер нашло самостоятельно. Товар шёл 2 дня. Спасибо розетке.
5,за такую цену - просто отличная мышка. Не вижу смысла брать дароже, есть строк службы у них одинаковый)
2,Найкраще працює на чорній поверхні. Підходить і для планшета.
4,Самая дешевая мышка. Работает.
5,рекомендую кращю мишку за таку ціну не знайти та взагалі за таку ціну я не зустрічав !
3,Коли ведеш по поверхні то курсор скаче, рухається ривками, потрібно підбирати поверхню, щоб було біль менш нормально. Оцінка 3 з 5.
5,Низкая цена, компактность и хорошее качество. Брал для нетбука и транспортировки, то что нужно!
3,За свои деньги неплохая. Для серфинга в интернете и работы с документами подойдет, но точно не для игр.
1,Мышка - дешевый китайский ширпотреб, сразу после получения подключил к ПК она никак не реагирует, после вытащил из USB, снова втыкнул заработала, при перезагрузке компа, история повторилась мышка не работает, то есть после каждого включения ПК нужно вытаскивать шнур мышки из USB разъема установка драйверов не помогла, покупкой очень не доволен
4,Мышь как мышь, дешёвая и рабочая.
4,Легкая и удобная для женской руки. Качество на свою цену - что бы в интернете видяхи открывать, делать рефераты и посты, вполне нормально и год точно прослужит, но, если кто работает в 2Д и 3Д редакторах то, конечно, колесо садится быстро. Хотя, грех жаловаться, за такие деньги - соотношение цена/качество вполне нормальное. Я использую ее для подстраховки, когда в моей рабочей оптической мышке батарейки садятся, а я накануне не позаботилась, что бы зарядить запасные, в принципе, выручает, хотя за месяц таких подстраховок и то колесо подубилось, но это специфика моей работы, думаю, дизайнерам или геймерам брать точно не стоит, а обычным пользователям - отличная вещь:)
3,Вполне доволен
5,Отличная мышка, для своей стоимости вообще супер!
4,За такую цену отличный выбор!
5,Хорошая мышка, муж жалуется правда что для его ладони маловата,но это все индивидуально. Меня устраивает.
5,отличная мышь)
5,Покупал мышь для планшета. Эта приглянулась по цене. Ну, что я могу сказать, мышка супер. Удобная, дешевая, шустрая и экономная в плане потребления энергии. В описании, к списку поддерживаемых ОС забыли написать Android.
4,Мышка понравилась, кабель можно и подлиннее.
4,Все працює все супер рекомендую
4,Працює на всі 99% для контр страйк супер (рекомендую)
