3,Так себе мышка, попользуемся будет понятнее на сколько её хватит. Кнопки тугие, правая с небольшим люфтом, подсветка как по мне слишком яркая, меня с непривычки аж ослепило немного, когда подключил её
3,Получил очень быстро спасибо розетка
5,Сама коробочка довольна большая,красивая,и легко распаковывается. В руке, как влитая. Всем советую!
2,За 2 месяца колесико мыши начало сильно люфтить в стороны. Полупрозрачные накладки провалились внутрь мыши (они держались на очень некачественном резиновом клее). ЛКМ начала цепляться за боковую "стенку" мыши. Боковые клавиши перепутаны местами (на всех мышках верхняя и нижняя клавиши у меня обозначались в системе как Х1 и Х2 соответственно, в на этой верхняя (передняя) - Х2, а нижняя (задняя) - Х1) - это привносит некий дискомфорт. Вердикт: годна только как временное решение (на 1-2 месяца).
4,Мышка за свои деньги отличная, пользуюсь около двух месяцев, внешний вид и качество сборки супер, немного шумные щелки.Из недостатков - колесико, оно скрипит при прокручивании.
5,World of Tanks стало приятнее играть ;)
5,Очень хороший выбор для шутеров в своей ценовой категории
4,зручна і симпатична миша
5,мне понравилось
4,Мышь хорошая, тем более за такую цену. Надеюсь долго прослужит.
5,Мышь прекрасная, тем более за такую цену.
5,После тестирования двумя детьми мышка продолжает справляться со своей задачей: кнопки работают, колесико хорошо функционирует.
5,Плавная и идеально лежит в руке. Очень удобно
4,Надеюсь долго прослужит. Но я бы всем очень советовал эту мышь: https://hard.rozetka.com.ua/aula_6948391211688/p12381105/ вот у неё нет недостатков.
5,Суперска миша
5,Крутой Товар!
1,Заказал эту мышку. Пришла в хорошем, с виду, состоянии, всё как полагается. Рабочие кнопки и подцветка. Но через какое-то время она перестаёт работать. То бишь, водишь по поверхности стола, а на мониторе курсор на месте. Отправил в сервисный отдел и всё никак не пришлют обратно!!
3,Сильно яркая подсветка-бьет в глаза, нет возможности отключить, нет фирменного ПО.По сравнению с Genius Maurus, берите ее.Пользуюсь уже неделю.
4,норм мышь,нужно немного привыкать после старой, юзается не плохо, только не подружилась с моим ковриком. были какие то неожиданные провертоны, теперь без ковра все ровно. Ночью работает вместо ночника))))) Вообщем на четверочку.
3,За свою цену не плохо, но качество сборки оставляет желать лучшего
2,За свою цену, не плохой сенсор После 3 дней использования во внутрь отпала пластиковая вставка. Открутил оказалось что вставки держаться на силиконовом клее, люфт боковых кнопок оказался из-за того, что одно из креплений качельки боковых кнопок было сломано, самое интересное что отломанного крепления не было в мышке. Так-же не горит один диод. В целом, можно покупать для шутеров, так как сенсор не такой уже и плохой, но обязательно нужен коврик.
2,на вигляд нормальна, в користуванні не сподобалася. ПОВЕРТАЮ
4,За свои деньги - отличная, посмотрим на сколкьо хватит)
5,Пользуюсь второй день - полет нормальный, в играх ведет себя достаточно комфортно, проблем не заметил.
