3,«киллер фитча» - второе колесико на практике оказалась для меня бесполезной, использую только для масштабирования в браузере. Виноваты в этом производители, которые не позаботились создать нормальную поддержку колесика на уровне драйверов. Хотите масштабировать размер кисти с помощью колесика в Фотошопе, перемещаться им по временной шкале в видео редакторе, или может использовать его в 3D программах вроде 3DSmax или Maya? Забудьте. Все что оно может делать, это дублировать функции основного колесика или выполнять функции сомнительной полезности, вроде переключения между приложениями, контроля яркости или громкости и .т.д. Возможно разработчики со временем добавлять возможность назначать кастумные действия для разных программ, но пока лично мне это не удалось реализовать даже сторонними средствами.
5,Прекрасная мышка. По свистку работает в панельном дома через 2 стены!
5,Пользуюсь не долго, но пока всем доволен. Эргономика на уровне, кнопки и их настройки работают интуитивно. Да, средняя кнопка достаточно тугая, но после М705 с кнопками влево-вправо в колесике - в МХ ее приятно нажимать. Радует настраиваемый смартшифт (надеюсь не вылезет баг с електромагнитным фиксатором колесика :) ) Советую всем кого не давит жаба.
5,Доволен этой мышкой. Очень хорошо продумано управление. Приятно использовать. Чувствуется что качественный продукт.
5,Я не можу описати наскільки ця мишка прекрасна, вона ідеально лягає на руку . Раніше в мене після 3-4 годин роботи боліла рука(особливо мізинець і безіменний пальці) з цією мишкою спіймала себе на тому, що просто забуваю що в мене в руці мишка, настільки вона ідеальної форми. Для мене вона як витвір мистецтва і повнісю коштує кожну гривню свої вартості. Зараяжку тримає 12 днів пр тому , що я юзаю її по 12-16 годин в день.
3,Покупая данную модель мышки, я рассчитывал получить, кроме эстетического удовольствия, позитив от ее эргономики. Ограничился лишь эстетикой - за 6 месяцев пользования, я к ней так и не привык. В моей руке (размер М по версии перчаток) она очень неудобно лежит, по факту наличия множества кнопок - использую лишь их стандартный набор. Что меня в ней радует - колесико, которое можно одним прокрутом запустить надолго (удобно в файлах с большим количеством строк. Еще время от времени она придумала терять связь с компьютером - танцы с бубном не помогли. Рекомендация будущим покупателям - потрогайте ее в магазине перед заказом, если сразу неудобная, то скорее всего, не привыкните к ней со временем.
3,Через 3 недели перестал работать переключатель режимов прокрутки. При нажатии на кнопку щелчёк есть, а само колесо так и остаётся в режиме свободной прокрутки. Буду обращаться в Сервисный.
5,Мышкой пользуюсь почти год - ниразу не пожалел что купил.
5,Не знаю чому її називають великою. Для мене розмір нормальний. Правда "стандартні" дійсно чуть менші. Для моєї ладоні хочеться ще довшу на 1 см по довжині. Юзаю для роботи за десктопом і планшета на дивані. Фіча 2 в 1 - це просто мрія! Спосіб переключення і ндикації активного пристрою кльово придумали :-)
5,До этого пользовался Logitech m405 и Logitech anywhere mx. Конечно же это новый уровень. Пока сплошной восторг, даже боковые клавиши понравились. Единственное, что заряда при моем очень интенсивном режиме использования, хватило всего на 12 дней. Около 8-10 часов 5 дней в неделю. Но поскольку заряжаться она может во время работы - это вовсе не проблема
5,Если вы UX/UI дизайнер, то берите и не задавайте глупых вопросов :)
5,Долго искал bluetooth мышь. Глядя на предложенные варианты становилось уныло от цен и ассортимента. Эппловская magic mouse уже не казалась дикостью. В итоге набрёл на эту модель. Дикий плюс -- она большая и тяжёлая. Поддерживает три устройства, заряда аккумулятора хватает на 8 дней по 10 часов в среднем. Отлично работает и с OS X и с Android. --- Если не работает скролл в базовом Терминале в OS X нужно снять галочку с пункта Secure keyboard entry и он заработает снова.
4,В целом мышка супер. Форма и эргономика очень хорошие. Несмотря на свой немаленький вес в 145гр. , управлять ей легко, если конечно не играть в игры , где требуется молниеносные движения мышки и т.д. Но есть и ложка дёгтя - нажатие на колесо (средняя кнопка) - очень тугое, и палец реально будет уставать , если использовать мышь для работы допустим с 3д пакетами ( я себе именно и брал для работы) и поверхность колёсика не способствует комфорту - оно слишком шероховатое. Боковые кнопки , как и обсуждалось в обзорах - неудобные - слишком мелкие. Использовать их конечно приловчиться можно - но тут логитековские товарищи похоже немного лапухнулись с продуманностью в угоду дизайну. Боковое колесо тугое - но в целом юзабельное, каких особых проблем с ним нету. Сенсор ест любую поверхность, так что в этом плане очень удобно. Быстро заряжается и плюс , что во время зарядки можно использовать мышь. Основные кнопки очень тихие. А вот колесо прокрутки - шумит довольно таки ощутимо. Меня это сперва немного бесило, сейчас привык. Хотя конечно на любителя такая точная фиксация прокрутки и соответственный звук от этого. В свободном "полёте" , когда включаешь режим свободной прокрутки - всё очень мягко и тихо. Кстати автоматический режим переключения прокрутки от скорости очень неплох - удобно! В итоге - мышь классная, есть свои приколы, но в целом мне очень нравиться. После Magic mouse 2 ( а я брал именно для imac) - привык буквально на второй день и уже не хочу возвращаться обратно на неё ни в коем случае))) Конектится по блютузу с аймаком без проблем , без ресивера. Он у меня остался лежать в коробке.
4,хорошая и качественная мышка, отличные материалы и сенсор. но мышка тяжеловата и не для маленькой руки. У меня был всегда хват коготь, поэтому пока привыкаю. Если вы хрупкая девушка с маленьким кулачком или хоббит, то эта мышка не для Вас.
5,Не нужно переключать на режим быстрой прокрутки, резко крутанул, и скрол переключается на быструю прокрутку! Безумно удобно! Очень качественная сборка, предыдущая MX Performance хуже. Автономность больше чем у MX Performance. Выбирал между этой мышью и Razer mamba elite (такая на работе) Мамба отдыхает. Светящаяся стойка её единственная прелесть, в остальном только разочарование.
4,В принципе все хорошо, но ничего особенного, кроме колеса прокрутки. На свою цену не тянет.
5,не знаю стОит ли она таких денег, но на обычную после такой уже сложно перейти, к хорошему быстро привыкаешь .... все кнопки/колёсики программируемые, отличный понятный софт для настройки .... инерционное центральное колёсико - это конечно фишка... в общем для тех, у кого комп приносит доход - мыша must have, ибо очень удобно
4,не ожидал, что окажется такая большая! до этой мышки были маленькие, так что пока привыкаю)
5,Жду появления )))
