1,я не ожидал настолько некачественного продукта от такой компании: громко клацают кнопки,ну а клик колесом слышат, наверное, даже соседи на 2 этажа ниже. эта мышь не позволяет провести ровную горизонтальную линию, только "волны". а ведь это сейчас умеют даже совсем дешевые мыши. рабочая g-cube и старый домашний defender не имеют с этим никаких проблем. при прокрутке колесом страницы в браузере периодически дергаются немного назад. отключение/включение плавного скрола в фирменной утилите Logitech Options абсолютно не изменило ситуацию. единственная ложка меда в этой бочке дегтя: мышь сделана из качественных материалов, ничего не скрипит, не люфтит. видимо это моя последняя покупка устройств компании logitech
4,Купил пару дней назад такую мышку своей жене. Качественная мышка. Красивая, в жизни красивей чем на картинке. Не маркая. Хорошо сидит в руке даже крупной. Но не по всем материалам ездит, лучше покупать к ней коврик. Сам пользуюсь уже около 10 лет Logitech M215 в разы лучше чем М238. Ей все равно по какой поверхности ездить, что не скажешь о данной мышке. А вообще за такую цену хорошая мышка.
5,брал на подарок
5,Высокая чувствительность, в фото-редакторе работать одно удовольствие... Не хочется выпускать из рук. Спасибо огромное
5,На цій мишці є кнопка виключення?
5,Мышь как мышь и так думаешь пока не возьмешь ее в руки ! Фото на дисплее монитора не передает той яркости как при распаковки мыши.... Яркая, чуткая, просто так что не хочешь ее выпускать. Очень удобная . На каждый стол она несет радость глазу, боковые прорезиновые вставки то что надо ! Покупкой очень доволен на все 100 % . Брал не здесь не на Розетке о чем жалею ( переплатил за доставку ), все таки Розетке молодец с сервисом и ценами. Берите и не прогадаете !
4,Для небольой женской руки самое оно! Хотя и для большой мужской тоже ок, но уже на любителя.
5,Очень довольна покупкой
5,Стильный дизайн,яркая. В работе отличная. Очень нравится. Я довольна! Спасибо
5,Купил дочке, потому что мою экспроприировала. Доча в восторге, у меня - счастье! Мышка вроде ничего особенного, но симпатиШная! Ребёнку то что надо :)
5,мышка реально круто и ярко смотрится работает изумительно
5,Мышка очень и очень симпатичная. Я купила лимон. Отличный сочный дизайн. Очень необычный. Ну иконечно же работает она тоже отлично! качество на 5+! Этоочень хорошо что компания Лоджитеквыпустила эту серию мышек. Так как серо-черные мышки уже настолько надоели.
5,Работает хорошо, радует глаз. А если еще и за видео распаковки дадут 100 грн. - то и по цене будет ок)
4,Мышка яркая и красивая, выбирала, чтоб была нескучная) она довольно маленькая, так что нужно привыкнуть -- за 3 дня постоянного пользования рука привыкла и не болит больше) очень легкая, работает от одной АА батарейки, есть отсек для юсб приёмника в целом, ок мышка
5,В целом это классическая беспроводная мышка от Logitech. Но в интересном дизайне, приятное на ощупь, не чувствуется дешевая пластмастность. Очень понравился прорезиненный материал по бокам мышки.
5,Простая мышка с красивым оформлением, работает, сигнал добивает обещанные 10 метров, больше от нее ничего не требуется.
5,Хорошая мышка
5,Вже 5 років користуююсь Лоджитек, у дома є мишка якій 4 роки, нема нарікань, надіюсь і ця мишка відпрацює своє)))
