5,Брал самую дешевую и самую простую для медиаплеера (TV BOX). Больше года каждый день не выключая пользуюсь этой мышкой. В комплекте с ней идет очень красивая батарейка, ставить её было жалко и посему установил старую умирающую "GP SUPER" от часов которая уже ничего не тянула. Каково же мое удивление!!! Батарейка работает до сих пор!!! Хотя медиаплеер находится от неё в 6-ти метрах!!! Мышка за эти деньги просто супер!!!
5,Користуюсь 1.5 роки практично день в день, неодноразово падала зі столу і досі працює, нічого не скрипить, кліки нормальні. Саме те для повсякденного користування
5,Рекомендую.
4,довольна
5,Чудесная мышь. Пользуюсь уже пару месяцев - нареканий нет.
3,Мишка підійде під ноутбук. Для ПК не рекомендую, передавач постійно барахлить, скоріше всього через вплив інших пристроїв поряд.
1,Сразу же после покупки начало ключить колесико, ужасно раздражает Лучше приобрести другую мышь
4,Хорошая мышка, для роботы на компьютере пойдет
5,4 месяца работает, проблемм нет.
4,Хорошая мышь, хорошей батарейки хватает на пару месяцев, работала верой и правдой около года...пока я не решил купить к ней в пару клавиатуру rapoo E9070. По совету от представителя компании попробовал произвести сопряжение двух девайсов, чтобы не занимать 2 порта USB. - после нескольких попыток сопряжение не удалось((( но самое печальное что мышка просто перестала работать. проверял батарейку (новые ставил), приемник распознается на ноутбуке (win7) и ПК (win10), но мышка просто умерла и не отвечает((((((
5,Заказал на розетке больше двух лет назад, по сей день пользуюсь.
5,Майже два роки спільного існування, а я і досі дуже задоволена покупкою.
5,Хорошо работает,очень удобная в руке
2,Каждые минут 10 теряет сигнал, приходится бесконечно включать-выключать. Жалею о покупке.
5,Два месяца - полет нормальный!
5,Еще один из плюсов этой мыши - заряда алкалиновой батарейки, которая шла в комплекте мне хватило на год использования.
5,Мышь очень понравилась. Пользуюсь 1 день, полет нормальный. Пока еще незнаю как долго будет работать от 1 батарейки.
3,Предыдущей мышкой был доволен, была такая же rapoo и даже в таком же цвете. Эта мышка расстроила, постоянно пропадает во время работы, приходится ее выключать и включать по новой. Это раздражает и явно есть какой то деффект. Предыдущая мышка работала идеально.
5,Отличная мышь, покупалась для работы с несколькими ноутбуками, как небольшая и удобная ноутбучная мышь, работает хорошо, обрывов (как тут пишут некоторые) не замечено, хотя рядом с мышью мощный стоит WiFi роутер который может генерировать помехи в том же диапазоне 2.4Ггц что и мышь.
5,Пользуюсь уже больше 3 мес. очень доволен. Берите не пожалеете !
5,Пользуюсь уже 2 месяца, удобная, симпатичная, не тормозит. В общем нареканий нет. Хорошая фирма
5,Всё устраивает. Гуд
5,Користуюся мишею вже тижнів два, і все кльово. Не знаю, чому у декого вона вимикається періодично, моя працює гарно. Я взагалі придбала одразу дві, одну - у подарунок. Обидві хороші.
3,Включили, вроде всё работало норм супер, через 5-10 минут постоянно пропадает сигнал (и/или выключается ), что делали: - меняли батарейку - вставляли в разые ПК - вставляли в разные ЮСБ 2.0 и 3.0 - пытались ставить дрова (их нет-только те что вшити в передатчик) - в электропитании на ПК убирали отключение ЮСБ для экономии энергии К сожалению не помогло, будем думать о возврате возможно попалась такая кривая )
3,Быстрая доставка, удобная мышка, но часто приходится вкл./выкл. мышку из-за зависания.
5,Купил на работу и понял, что можно смело брать домой. Полюбил эту фирму. Не хочу сильно пиарить, он мишка ОООЧЕНЬ хорошая и качественная
5,Уже год с этой мышью работаю и играю, ни одного нарекания нет, довольна, как и в целом продукцией компании. Всегда выбираю рапушку, если есть такая возможность.
3,Берите ее только в том случае если вас не бесит постоянно выключать - включать мышку. Иногда работает без перебоев, но это то еще "иногда" =_=
5,Отличная мышь))
3,мені подобається
3,Хороший бюджетный вариант.
4,Отличная, недорогая мишка брал по акцеи.Очень компактная, и льогкая но это плюс тем кто носит ноут з собой
4,Хороша, якісна миша. Придбав дві штуки: дружині - білу, собі - чорну. Обоє цілком задоволені. Жодного разу проблем чи запитань не виникало. Я та моя дружина рекомендуємо усім.
5,советую
5,Покупал дочке на ноутбук, ей нравится.
5,Мышь отличная, хорошо лежит в руке, красивая. Батарейку не менял с момента покупки - четыре месяца прошло (в предыдущей А4 менял каждый месяц, наверное). Рекомендую.
5,Мышками Rapoo пользуюсь не первый год, правда другими моделями, батарейки меняю раз в полгода, даже забываю о них, надежны, пока не подводили. В этой понравилась функциональность, дизайн и цена, надеюсь бренд не подведет и в этот раз. Батарейка одна, возможно, придется чаще менять. Пока все работает.
5,Очень даже приличная мышка за такую цену. Пользуюсь несколько дней. Если бы еще ненужно было ее каждый раз отключать, вообще бы цены ей не было.
5,Потеряла от мышки usb bluetooth адаптер, подскажите как он правильно называется и можно ли купить отдельно?
4,Приобрела недавно эту мышку, пользуюсь недавно, пока довольна. До этого пользовалась проводной мышкой. реагирует даже если водишь по плюшевому покрывалу.
5,Мышка проводная стала подвисать , похоже что шнур перегнула где то и повредила . решила заказать беспроводную помощницу --- Мышкой довольна!!!! пусть служит мне долго и радует меня))) Довольна что заказала в Розетке,это мой первый опыт заказа в этом интернет магазине . Всем Спасибо! Любви и Процветания))))
5,користуюся місяць і все влаштовує
5,супер
5,отличная мышь,качественная сборка,работает отлично
5,Пару дней, впечатление отличное. Аккуратная, красивая, для девушек - супер))
5,одни плюсы
5,Брал к ТВ приставке работает без проблем на андроид.
5,Почти у все беспроводных мышек не дорогого диапазона есть проблемы с работой: они притормаживают и колесико прокрутки работает с рывками, произвольно выключаются. НО! эта мышка - не тот случай. Работает отлично, ни единой проблемы еще не было выявлено.
5,Я довольная .
5,На свою цену хорошая мышь.
5,Хорошая мышка. Пользуюсь больше месяца - полет отличный!
5,Отличная мышь!!! Купил для работы, а теперь знаю что можно и домой брать. Для своей цены - отличный выбор. Приятный пластик, красивый дизайн, и очень качественная сборка. Короче огонь!))))
5,Хорошая мишь. Рекомендую
5,Мягкий ход клавиш, приятный скролл. Положительные впечатления.
5,На свою цену шикарная мышь. Пользуюсь с удовольствием.
5,Рекомендую. Клавиши нажимаются нормально. Разве что колесико скользит очень легко, но в офисной работе это не мешает...
4,Хорошая мышь, работает нормально.
5,Действительно всё очень неплохо. Недорого, работа стабильная, экономная, на любой певерхности без скачов.
5,Отличная мышка. Работает практически на любой поверхности....
5,Дуже зручна у використанні. Поки що не було жодних лагів. Я задоволена)))
5,Пользуюсь мышью чуть меньше месяца, и уже успела ощутить все преимущества беспроводной технологии: провода за ноутом не путаются, ничего не мешает, набирать текст - просто песня! И хотя ноутбук у меня черный, рядом с ним эта мышь смотрится очень стильно. Поэтому однозначно рекомендую всем тем, кто еще сомневается. За батарейку в комплекте производителю - плюс к карме :)
5,Рекомендую!
5,Для ноутбука именно то что надо. Советую к покупке.
3,В цілому достойна миша для роботи за столом
5,чудова миша
5,Чудова мишка. Зручна у користуванні. Зроблена, як на мене, з хорошого, якісного матеріалу. Купував дружині, тепер ненарадується нею.=)
5,Пользуюсь данной мышью первый день, пока всё в порядке. Пластик приятный на ощупь, мышь удобно лежит в руке. Батарея AA в комплекте. Отлично работает на любой поверхности. К недостаткам можно отнести довольно маленький размер мыши (не всем такой размер придется по душе) и достаточно громкие клавиши.
5,Я люблю фирму Rapoo. Не знаю почему. Они красивый, приятные на ощупь, долговечные. Нравится пластик. Добротный. В отличие от китайских поделок из тонко хрустящего пластика.
4,Купил эту мышку для белого MacBook. Покупкой полностью доволен. Мышь прекрасно работает на глянцевой поверхности, для маленькой ноутбучной мыши - довольно удобная, субъективно кажется даже чуть удобней, чем Logitech M185, ввиду немного большего веса и высоте.
4,Брав для білого ноутбука цю білу мишку. Брав не для ігор, а для офісної роботи.
