5,купив мишку місяці 2 тому, політ нормальний, подобається покриття і ергономічний дизайн, рука не втомлюється при роботі з нею. Миша не дешева, але на даний момент покупкою я цілком задоволений
3,Около 5 лет назад я уже приглядывался на DAdder, брал на тесты у друзей и иногда играл на них в Арене. Ничем они не впечатляли. К тому же был не редким даблклик с завода. Продукция Razer была отмечена как низкосортная и не воспринималась всерьез. На дворе 2017, и к сожалению, logitech g500, которая служила мне правдой 4 года временно пришла в негодность (даблклик, но я это исправлю). Первым кандидатом на новую мышку стал Logitech G403 Wireless, но в наличии её не оказалось. Решил дать шанс Razer DA Elite, в надежде, что за последние 5 лет они таки научились делать что-то достойное, но надежда не оправдалась. Форма мыши еще с самых первых версий напоминает легендарный Microsoft Explorer 3.0 (https://hard.rozetka.com.ua/22380/p22380/), но далека от него по эргономике! Ничего позитивного по поводу сенсора сказать не могу, так как в 99% случаев он не отличается от любого другого в мышке, ценовой категории 50$+. К тому же, даже проигроки не используют выше 1200DPI. Погоня производителя за 16k+ dpi просто смехотворна и расцениваться мною лишь как рекламный ход. Микрики на 50млн не внушают доверия, хотя их замена не составляет труда. Вердикт: хорошо показала себя в шутерах (Quake Champions и CS:GO) на 600DPI. В Dota2 не слишком удобна, за десяток игр на вокере так и не привык к ней, хотя пробовал разные DPI с шагом в 100 (400-800). Мышь скорее всего верну, не смотря на приятный бонус в виде коврика speed. С игровыми мышками я на "ты" с 2002 года и расцениваю свой отзыв как объективный, будучи ранее даже проигроком. В моем "арсенале" были Microsoft Explorer 1.1a и 3.0, Logitech mx510, mx518, g300, g400, g500. Еще больше мышей брал "на прокат" у друзей.
5,Какой для нее выбать коврик razer goliathus speed или control?
5,Какая здесь модель сенсора?
5,Купил на замену Logitech G302, который опять сдох через 2 года, так же как и g300 до него (даблклики левой кнопки). На G Pro просто уже не решился... Первый продукт Razer и я приятно удивлен, в сравнении с предыдущей мышей - все лучше. Приятная подсветка, даже оставил. Клики тише и приятнее. Форма будто под мою ладонь слеплена, даже привыкать приходится к излишнему удобству. Кабель мягкий и в оплетке, не дыбится и никуда не упирается. Сборка такая же добротная, не придерешься. Заявлено до 50 млн. кликов, есть надежда что прослужит 4 года, если что то другое не отвалится, посмотрим. Могу придраться только к колесику, которое очень торохтит при резкой прокрутке, но у G302 оно звонко трещит в любом случае, здесь его хоть вообще не слышно при медленном скролле вниз и то уже лучше.
5,Мышь стоит своиг денег,хороший и качественный товар!Советую её
4,#мояраспаковка
5,Файна мишка, мені подобається ! Сенсор чудово справляється в КС ГО !
4,Так как мыши я меняю редко ,только при выходе из строя,то сравнивать буду с A4Tech Bloody V7 http://hard.rozetka.com.ua/a4_tech_bloody_v7/p248028/ которой я пользовался уже пятый год до недавнего времени.Решил её сменить т.к скролл начал проскальзывать ,дело в том что у меня на нем стоял "бросок гранаты" и я его активно использовал - думаю если починить она ещё столько же прослужит.Пересматривал обзоры и думал какую же мышь выбрать Razer Death Adder Elite или Logitech G403 Prodigy .Выбор остановился на первой т.к эргономика мне показалась более подходящей ,тем более в обзорах очень хвалили устраненные недостатки предыдущей Дарьи ,и что эта мышь является чуть ли не лучшей что сейчас есть у Razer.Первое визуальное впечатление от мыши - она превосходна ,в ней нет ничего лишнего ,и очень изящно смотрится.Взял в руку - вроде то что надо ,но всё равно для моей руки 20 см лучше б она была чуть подлинее ,часть руки ездит по ковру.С этой мышью мне пришлось ладонный хват поменять на пальцевый (привыкаю).Предыдущей мышью играл 1600 dpi ,в этой остановился на 2200 dpi.Подсветкой побаловался и отключил ,так она мне больше нравится .
5,Почему на сайте розетки указан вес 240г, а на оф. сайте Razer 105г?
