5,Користуюсь майже 3 роки. Razer створила просто ідеальний продукт для геймера! За 3 роки не було жодної поломки, підлагування. Краска не злізла, хоча користуюсь кожен день. Кнопки - не люфтять, підсвідка працює. Абсолютно задоволений покупкою! Дизайн мишки дуже сучасний і крутий. Зразу падає в око при погляді на робоче місце. Дуже зручно лежить в руці. Привикаєш до мишки уже в перший день. Два датчики руху, що дозволяє користуватись мишкою на будь якій поверхні, навіть не рівній! Програмна підтримка на висоті! Постійно обновлюється. Можна налаштувати режими чутливості під себе. Причому всі настройки підгружаються із облака після перевстановлення віндоусу ітд. 5 із 5!
5,Користуюсь мишкою 1,5 року , в основному для ігор. Єдина порада усім , хто захоче купити цю мишку: просто ЗАБУДЬТЕ про те , що можна нести тарілку з хавкою від кухні до компа !) Крихти які падають на коврик можуть попасти і в сенсор мишки із-за чого в мене бували глюки , що мишка просто переставала мене слухатись , але після чистки все продовжувало працювати на ура)
5,Rozetke отдельное спасибо, все договоры, доставка и культура общения проходят на отлично. так держать ребята!!!
4,Кто пользуется мышкой больше полгода,отпишите свои ощущения,ломалось что-то или нет?
4,Кто пользуется мышкой больше полгода,отпишите свои ощущения,ломалось что-то или нет?
5,Отличная мышь,хорошо лежит в руке,подсветка радует и особенно нравятся резиновые вставки по бокам) юзаю с этим ковром Razer Goliathus 2013 Large Control А теперь вопрос к представителю Razer: почему может не работать статистика в razer synapse ? пробовал переустанавливать, добавлять игры заново но не помогло,подскажете что то?
5,Если будите брать данную модель, то покупайте с ковриком http://hard.rozetka.com.ua/razer_goliathus_2013_medium_control/p332005/
5,Клики очень громкие?
5,Отличная мышка, удобно лежит в руке. Сразу чувствуется действительно качественная вещь. Под мышку приобрел коврик Razer Goliathus 2013 Medium Control.
5,Лучшая мышь, которая была у меня! № 1 в шутерах. Когда взял в руки, ощущение дорогой, элитной, шикарной игровой мыши.
5,Хорошая мышка, привыкание длилось дня 4. Розетке спасибо доставили оперативно)
5,Здравствуйте! Купил эту мышь не на Розетке, но сайт всей душой люблю, отличный:) Юзаю мышку уже месяц. Сутками играл в ММОФПС с минимальной чувствительностью, не подвела. Движения мыши соответствуют движениям курсора. Все как нужно. Разочаровало только то, что рейзер сделали так, что ковры от х7 или стил сириес не подойдут, мышь будет плохо ездить ( то что очень плохо для тех кто играет в ммофпс), поэтому нужно брать ковры только от Рейзер. В руку не сразу легла, но я привык. Красивая, симметричная мышь с подсветкой. Подсветку можно отключить в Рейзер синапс. Синапс, кстати, не сильно порадовал, могли бы сделать так как сделали а4тек с х7, что-то типа Оскара. Но в Синапсе можно сделать все как хочешь, полностью настроить уровни чувствительности под себя. Иногда при включении компьютера сбивается дпи и его приходится перезагружать, может какие-то проблемы с гнездом, не исключаю этот вариант, но думаю сказать стоит) Пока что это одна из лучших придуманных на данный момент мышей в мире. Более мощные характеристики есть не у многих. Но это уже слегка пафос. Так круто можно было и не делать, перебор). Но все же тем кто разочаровался в реальности и играет в игры сутками - шикарный вариант.
5,Мышка супер доволен всем!
5,Для тех, кого напрягает мигающий логотип или светящийся колёсика нужно установить драйвер Razer Synapse 2.0, в настройках есть возможность отключить то и другое по отдельности.
5,какой коврик лучше для этой мыши ??
5,Брал исключительный для игр. Пользуюсь уже 5 мес, бесконечно доволен. Идеальна для геймеров.
4,В принципе доволен мышкой,однако для моей руки она несколько маловата(( Если у вас крупная рука,стоит брать мышь побольше.
4,Хороша мышь удобная и привыкнуть быстро. Брал не себе но пользовался понравилась
4,Здравствуйте всем . Брал мышь на розетке .У меня есть такая проблема с мышью как зависание курсора , пользуюсь мышкой 2 дня , и бывает что оставляю комп на пару часов включенным , сажусь за комп , а курсор проходит расстояние и виснет , и так около 10 мин. Может знает что делать с такой проблемой ? И еще , около часового использования мыши в шутерах , начинают отключатся 2 верхнии доп кнопки и одна боковая , они у меня настроена так ,верхние - смена dpi , с боку за смену профиля ,вот они не работают время от времени , и так все если поставить смену dpi или смену профиля на остольные доп , то они кнопки работают . Подскажите плз что делать .
5,Берите , не пожалеете !
5,Люблю Razer, это реальный брэнд который я надеюсь будет держать свою марку на высоте они знают что нужно в реалье ... долговечность, удобносто для длительного время провождения в компе, полного погружения в игровой процес.... я просто молчу они как будто делают эти штуки для себя и для души и деляться своим золотом с нами))))) !!!!!!!!!!! Лично я думаю многие присоединяться к моим словам ! Razer ТАК ДЕРЖАТЬ!)))
5,что брать для шутера и РПГ.... Taipan или Deathadder ??
4,очень понравилать , только бида не могу найти как отключить правые дополнительные кнопки , подскажите пж
5,Покупал здесь. Специально для игры в Battlefield 3 (4). И не ошибся. Чувствительность и отзывчивость грызуна, просто ввела в шок. Не ожидал. Даже сравнить не с чем. Настоящий игровой продукт, высшей пробы!
5,Мишка дуже сподобалась. Дуже поррадував новий дизайн та зелене підсвічування мишка добре сидить в руці . Девайс добре ковзає навіть на мому старезному коврику . Щодо сенсора на девайсі стоїть сенсор 4G з розширенням 8200dpi тобто Razer не перестає дивувати хоча надалі дивувати немає сенсу адже на максимальному розширані сенсора (на максимальній чутливості ) можна спокійно геймити тільки маючи чотири екранну FullHD систему . Дехто жалівся на зручність клавіш біля мізинця але треба памятати що мишка для лівші і правші водночас , якщо дуже потрібно можна використовувати клавіші зверху настроївши їх у Razer Synscape 2.0 ця програма зручна з простим , зрозумілим і гарним інтерфейсом , Також програма дозволяє адаптувати вашу змійку під будьякий коврик . Дуже порадував кабель в оплеті .
5,все понравилось
5,вот купил себе мышку пользуюсь недолго но претензий нету к ней всё отлично работает, в темноте горит отлично, кнопки нижимаються просто замечательно.
4,Качество сборки на высоте. Однако, данная мышка невероятно мала по размеру. С моей 20-ти сантиметровой ладонью я чувствую стол, но не мышку.
3,Датчик и покрытие отличные, но т.к. мышка рассчитана и на правшей и на левшей - имеется дополнительная пара неюзабельных кнопок с боку, которые давят в безымянный палец.
4,К самой мышке вопросов нет, в живую даже лучше чем на фото. Удобно, качественно, но все что касается софта у RAZER не всегда хорошо. SYNAPSE 2.0 - все лезут в "облака" и RAZER не исключение, как бы они не хвастались, но этот софт работает "горбато" и многие об этом говорят. Драйверов нет, не в комплекте не на сайте. только установив Synapse 2.0 можно использовать весь функционал мыши, при этом тебя заставляют создать учетную запись, иначе никак. После настроек, калибровки мыши, можно играть, но после рестарта компа, все слетает, и надо настраивать заново. Возможно конечно выпустят обновление в котором все поправят.
5,Когда ожидается сей девайс? ROZETKA: Добрый день! Ориентировочно ожидается в конце августа или начале сентября. Добавьте товар в лист ожидания, и Вам придёт уведомление о его поступлении.
