5,спасибо куму за подарок! мыша просто БОМБААА! красивая, удобная, приятная на ощупь! не понимаю предыдущий отзыв: - гарантия на нее 12 месяцев - очень прикольная подсветка, переливающаяся - длинна кабеля ПОЛТОРА МЕТРА! это короткий кабель??? при чем сам кабель в тканевой оболочке даже ферритовое кольцо есть-хотя не понимаю зачем оно тут, какой-то геймерский прикол наверное.
4,Купил мышь относительно не давно, доставка за 1.5 дня!
5,Советую брать с ковром по акции, хорошо ездит по нему и ковер не маленький
5,Мишка дуже крута та зручна
4,Подсвєтка крутая,в руке лежит неплохо,но малость большая.
5,Класс,берите,шнур отпадный
4,по приезду на дом , обнаружил люфт колеса мышки , а так и DPI и остальные нюансы работают на уровне
3,Вообщем получила сегодня мышку, впечатления двоякие, но больше негативных нежели позитивных! Боковой пластик люфтик и скрепит, хотя тут можно вспомнить о цене данной мышки и то что она "ГЕЙмерская". Как-то со стороны производителя это слишком, да хочется вспомнить еще и отзывы по поводу сенсора , что он слишком чувствительный когда мышку поднимаешь на небольшую высоту! Вот вродь бы все замечания!
5,В ксго при резких раворотах на сенсе 0.8 срывов нет, советую
5,Проработала где то пол года, начал отходить штекер потом вовсе перестала работать, сейчас продолжает работать но небольшой ремонт сделать пришлось
5,Спасибо большое за мышку! Всё очень круто! Мышка пришла курьером за 3-4 дня! Огромное спасибо Розетке!
5,больше 2 месяцев пользуюсь
5,Отличный товар за свои деньги.Купил и не пожалел.Советую всем!!!
2,Досить приємна на дотик, але відчувається погана якість (що логічно за таку ціну). Отримав тільки сьгодні так шо якісь глобальні висновки робити рано, але вангую що скролл довго не прослужить. дуже делікатний і люфтить
5,Супер!
3,Вчера привезли, впечатления на 3, внешний вид понравился, переключение DPI и подсветка тоже, но подсветка только пульсирующая, постоянной нет, тугой ход колёсика очень портит всё впечатление. Кажется, что проработает месяц, не больше.
2,Просто ужасная мышка! Лазер реагирует на коврик на 2 см висоты ....
5,Просто восторге сам меняешь подсветку можно выключить ейо очень удобно лежит в руке рекомендую
5,Мышка просто шикарная за свои деньги. Удобная, бюджетная, кабель в оплетке. Чего стоят боковые клавиши, они просто замечательные...Плюсов очень много... Ни капельки не жалею о покупке.
4,Несколько часов усердных тестов показали хорошее качество в разных играх. Как "лем" в Counter Strike и опытный игрок в Dota 2 (Invoker сигнатура) могу смело сказать - брать однозначно. Отзывчивость на уровне, "прыжков" сенсора нет, случайные "даблклики" не проскакивают.
5,Мышь не плохая. Стоит своих денег. Только вот колесико сломилось за пол года. Я могу использовать гарантию в другом магазине или мышь нужно отправлять вам?
5,Очень хорошо. Всем советую!
5,Всем рекомендую
5,Мышка отличная для своей цены,удобная в руке ! Рекомендую!!!
5,За свою цену просто огонь.
1,Купил мышку для пары к клаве той же фирмы,чтоб все было едино и красиво.Качество очень низкое,боковые панельки-накладки живые,ходят ходуном и скрипят,очень раздражало! Снял и посадил на клей,теперь всё ок!Пользуюсь три недели,колесико пока работает,подсветка работает,довольно легко настроил и подобрал для себя чувствительность,в играх всё норм,ничего не дергается!
5,Отличная мышь за свои деньги. Хороша как для офисной работы так и для игры. Работает уже 7 месяцев без единой неполадке!!!
4,Купил данную мышь. Сама по себе дешёвая. Мне нужна была мышь с подсветкой. К сожалению разочаровался. подсветка меня не устроила. Как показано на картинке там с желтая подсветка, у меня ее же не было. Светится не ярко. Но с "дипиаем" все нормально.
5,Пользуюсь уже как неделю никаких западаний ничего мышка просто бомба для Cs Go подойдет в самый раз только сенсу надо настроить под себя.
5,Отличная за свою цену
2,Мыш сама по себе ничего такая.
5,Працює відмінно, користуючись майже рік недоліків не замітила.
3,Вполне пойдёт для офиса, но точно не для игр. При игре в ксго на сенсе 1.21 и DPI 800 постоянно срывался сенсор и комфортно играть было невозможно. Через несколько месяцев использования перестала работать ЛКМ. Подсветку можно оффнуть при нажатии на доп.кнопку и на DPI одновременно. Также если зажать кнопку DPI, то перестаёт пульсировать подсветка и перестает работать колесо.
5,Прожила 7 месяцев почти, наконец появились дабл клики и прочие признаки умирания кликеров. За свои деньги - отличный грызун. Рассчитывал на месяц-2, а прожил вон сколько. Причем не слезло даже покрытие на верхней части корпуса.
2,Если вы берете ее для игр типо доты, кс и т.д = не берите. Не прослужила и месяц. Сначала появился двойной клик на левой кнопке мыше, позже колесеко начало заедать(крутишь вниз,а оно крутиться в верх), потом колесико вовсе слетело и не реагировало. Может я такой везучий но такая беда.
5,Крута мишка )Рекоминдую
1,Не раджу!
1,Мышка неплохая, но сломалось колесико спустя 2 месяца пользования, еще и в гарантии отказали - мол механическое повреждение, до этого была 8 лет A4Tech - все нормально, а тут такое... В общем, если покупать на месяц-два пользования - сойдет, если больше - выбирайте другую.
4,Яркая, стильная, красивая, но через 3 дня сломался шпиндель на скроле. Не беда если есть откуда скрутить запасные детали.
5,#мояраспоковка пришла Новой поштой быстро за два дня!
4,Хорошая
3,Нормальная мышка, меня устраивает. Поиграть в симсов, посидеть в интернете - для этого подходит. Брату дал попробовать - у него в CS:GO когда поднимаешь мышку немного над столом, начинает курсор дёргаться, нервы мотает при игре. Ещё при нажатии на боковую часть корпуса издаётся скрип. Короче, не стоит ожидать многого, покупая эту мышку. Обычный манипулятор в красивеньком корпусе с подсветкой. Как подарок сойдёт.
5,Пришла быстро, производительность на высоте, игры тянет на ура, советую всем.
4,Мышка легкая с небольшим утяжелением , удобная в руке. Красивый дизайн раскаленной лавы.3 световых режима. Хороша для игры WoT в остальные тоже будет нормальная) небольшой луфт с левой стороны, но он не мешает. За 2 месяца использования ни одного лага.Все кнопки работают хорошо и матовость не стерлась.
2,Удобная, эффектная, но ненадежная.
4,Отличный товар
2,Уже как второй раз приходиться ремонтировать колесико. Думаю на третий раз выкину в мусор. В остальных случаях вполне доволен.
2,після 3 місяців роботи мишка левая кнопка миши начала глючить "работать через раз" не советую покупать буду собиратся покупать другую
4,Хорошая мышка. Мышка весьма неплохая. Хочу отметить качественный провод, а в остальном стандартная мышка. Нормально без грехов проработала она у меня 3 месяца. сейчас периодически тупит колёсико.
5,клас
3,Через 18 дней сломалось колесико!!!
4,Нормальная, большая, выполняющие свои обязанности мышь. Не самая большая надежность компенсируется легким ремонтом, ценой и внешним видом.
3,Никакого ВАУ эффекта. Вы получаете ровно столько, сколько заплатили. дешманская мышка со встроенной китайской гирляндой. 1) Боковые клавиши сильно люфтят. Одна клавиша имеет очень легкий ход. Срабатывает при малейшем прикосновении, а что бы нажать вторую, нужно приложить достаточно большое усилие. Активно пользоваться ними - невозможно. Либо срабатывает когда не нужно либо в нужный момент с первого раза не нажмешь. 2) Глайды наклеены криво. Даже не смогли попасть наклейками в посадочные места. Края торчат и собирают пыль. Надо самому переклеивать. 3) Основные клавишы громко кликают. Но срабатывают четко. С колесиком прокрутки тоже проблем нет. 4) Однотипная интенсивность мерцания подсветки вызывает стойкую ассоциацию с дешевой гирляндой. Почему нельзя было сделать, что бы она просто светилась??? Кроме этого "негатива" (вполне ожидаемого, учитывая стоимость девайса) мне нравится форма мышки и ее вес. Так же плюсик за упаковку и кабель в тканевой оплетке... Порадовали...
4,Колесико мыши не работает хорошо что есть боковые кнопки заменил их на прокрутку в верх и вниз.
5,Хорошая мышь. Спасибо. Удачи.
5,Катаю долго топ мыха
5,Супер Дуже Классна!
5,За цю ціну мишка просто чудова, підсвітка набагато краща за ту ,що на фото.
5,Данный товар, я получил в магазине Rozetka, обслужили меня в пункте приёма на высоте, товар очень мне понравился, он стоит своих денег и даже больше, очень прочный кабель, удобное колёсико и клавиши, ну вообщем я довольный покупкой.
4,За свои деньги мышка просто прекрасная! Дизайн шикарный, 2 дополнительные кнопки под макросы тоже хорошая плюшка. Но есть сомнительные 2400 dpi, Не слишком ли много для мышки за такие малые деньги? Не китайское преувеличение ли это? Из за отсутствия софта и возможностей ее проверить ставлю 4, а так мышка хорошая, если у вас мало денег и вам нужна хорошая игровая мышка обязательно берите!
5,очень крутая мышка
3,купил вчера мишку привезли доставкой подключяю и тут бац не работает колёсико не листает страницы в верх низ в играх так же само нету приблежения колёсиком
5,Закачал вчера ( 15.02.2017 ) приехала в течении 24 часов, упакована была хорошо, в красивой коробочке, сама мышка с виду красивая, подключил красиво начала светится, разные цвета, все работает, нигде никаких дефектов не обнаружил, все работает все хорошо, спасибо большое)
2,Сегодня пришла данная мышка, если вам некуда деть деньги - покупайте, как по мне так лучше доплатить и купить что нибудь нормально, мыша плохая. Теперь по пунктам: 1) Колёсико - при нажатии 8 раз из 10 оно просто нажимается и залипает, назад само не откликивает, приходить его пальцем снизу вверх поддергивать. 2) Запах пластика просто термоядерный) Но я думаю через день-два выветриться, это не большая проблема. 3) Ножки снизу мышки наклеены криво, из за этого мышь как бы переваливается со стороны на сторону, от чего сенсор иногда дергаться как в приступе эпилепсии. 4) Иногда срывает сенсор. 5) По размеру она реально огромная, и для такой большой мышки форма не удобная, браться не удобно, постоянно выскальзывает, если у вас рука как у великана тогда возможно вам и подойдет. Понравился в данной мыши только шнур, довольно плотный, в хорошей тканевой оплетке, думаю что такой перетереть или переломить будет очень трудно) И на внешний вид мышка довольно красивая, с красивой подсветкой.
4,отличная мышка за такие деньги
2,мишку уводить вбік при різкому повороті руки
5,сегодня доставили мышку . все работает гуд за такие деньги качество отличное.
5,Ну приехала мыша, вроде как без повреждений. Сама мыша красивая и удобная. Люфт в сборке только в правой стороне сборки, оооооочень маленький, не значительный. Боковые клавиши конечно очень легко нажимаются, но это не проблема. Не люфтят. Клавиша DPI люфтит и нажимается хорошо только ближе к колесику. Колесико, видимо еще не разработалось немного шершавое, нажимается прекрасно, люфт присутствует но допустимый. Функцию мыши исполняет ПОКА идеально. Не знаю почему вам воняет, мне вообще не воняет если не прилаживать к носу.
5,Добрий день, я замовив мишку і в мене немає паспорта, що мені робити?А приїде на нову почту!
3,Цена-качество
5,За свои деньги годная мишка!
5,Отличный выбор!
5,Пользуюсь 2 месяца, хорошая мышь по такой цене. Больше подходит для warfase, cs:go, warcraft
5,пока работает
5,top
3,Все хорошо в этой мышке. Кроме веса. Оказалась неожиданно тяжеленькой. Играть в экшн сложновато. Привыкнуть нужно. После обыкновенной офисной.
5,Чи світиться коли пк вимкнений?
1,Сломалась (23 ноября 2016 купил)
1,перестала працювати через тиждень.
4,Мышкой доволен. Поначалу неприятно пахла, но через несколько дней пахнуть перестала. Хоть и написано "утяжеленная конструкция манипулятора", но для меня она легкая и это для меня плюс, а не минус. Корпус не для маленькой ладони.
5,купив цю мишку - задоволений. чотири швидкості, красива підсвітка, зручна.
1,Через 5 минут простого использования отказало колесо прокрутки и боковые клавиши. Обидно, т. к. мышь хорошо лежит в руке, имеет приятный дизайн, но увы...
4,Вообще, если честно мышь довольная посредственная, для мышек подороже, но в этом случаи она стоит намного меньше и имеет довольно не плохую подсветку, правда... Не без минусов, то беж её хрупкость, она в руках почти идеально лежит.
3,Пользуюсь уже четвёртый день,работает хорошо,всё клавиши работают кроме одной,клавиша подсветки не работает. Я имею ввиду не сломалась,а не работала вообще с самого начала(
4,Отличная мышь, говорили что от неё сильный запах пластмассы, но вот получил и ничего не воняет. Всем советую, отличная цена.
5,Спасибо
1,не покупайте)себе купил норм а другу за 2 дня поломалась((
4,Купил мышку для себя по началу есть слабый запах пластика
4,Покупал как для себя так и для брата, изначально мышка сильно воняла пластмассой. После каждого использования нужно было мыть руку.Ну в другом мышка хороша!
5,Обыкновенная мышь, просто красивая. По характеристикам все соответствует. Говорили что скрипит левая сторона, возможно им попался брак, у меня все в норме. Сама мышка щелкает не тихо. Покупкой доволен! Покупайте пока есть!
5,Очень понравилась кнопочка, которая переключает режим подсветки и одновременно изменяет сенсу мыши. Знаешь, какая подсветка отвечает за чувствительность, и это не может не радовать.
4,За такие деньги мышь классная, подсветка тканевый провод. Кнопни по бокам для бинда или чето другого. А вот пласмасой жутко воняет, но уже 2 дня пользуюсь более менее, и то что калесико чуток ушло в правый бок Так что, кто хочет мышь типа геймерску и нету денег, эту берите
5,Ребята всем рекомендую эту мышку.Очень классная. Светится в темноте .Возможно изменить цвета в мышке. Мне нравится эта мышка.Рекомендую.
5,Мышь прикольная!
5,покупайте, пока они не закончились на сайте. Честно , я не пожалел что купил)
5,Мышка просто супер и спосибо Розетке за оперативность
4,Отлична мышка есть они недостаток скрипит левая сторона
5,Софт есть?
5,За такую цену мышка супер
5,Просто прекрасная )
5,Превосходно!!! Пожалуй за эту цену лучший выбор! Хотя и писали ниже что есть проблемы с сенсором и мышку часто "уводит" в сторону, но лично у меня все в полном порядке. Хорошее качество сборки - мышь удобно лежит в руке, кабель в оплётке, несколько режимов dpi которые, к слову, работают вполне адекватно, наличие подсветки. За такую смехотворную цену - идеальный выбор!!!
4,Мишку замовив 3 тижні тому. За цей час мишка чудово працює і не підводила мене.
5,просто шикарная и не дорогая мышь. после этих беспроводных, которые из под стола не ловят, эта просто вообще супер.
