3,Бюджетная "геймерская" мышь, ничего особенного, стандартная сборка. Хорошо подойдет тем кто не хочет тратить много денег на мышь, а юзать что то надо. Не знаю сколько прослужит, навскидку должна около 3-4 лет отслужить, шнур не умрет - что хорошо, клики не сломаются, предположение что умрет первое - колесико (будет проскакивать или неправильно реагировать), так что своих денег она стоит. В играх себя хорошо ведет, сенсор не прыгает, курсор не подводит. В МОБА 10 потных откатано - не подвела. БИРИ!!111 надеюсь дождемся драйверов и программ для настройки боковых.
4,Отличная мышь на свои деньги. Красивая, приятная на ощупь, удобно лежит в руке. Но очень сильно несёт резиной, запах остаётся на ладони продолжительное время.
3,не работает переключатель dpi,нет клацанья а надо приложить сил чтобы нажать и эфекта 0
5,Отличная мышка
5,нормальная мышь за свои деньги
5,Мышка очень хорошая)))
5,отличная мышка за такую цену
5,Как для игр таких как cs go, подойдёт ?
5,Хорошая мышка всем советую!
5,Мышей доволен - по столу легко ездит даже без коврика, приятная подсветка + очень удобная резиновая вставка под большой палец, советую брать)
