5,Прекрасна мишка! Надзвичайне поєднання ціни і якості. Зручно лягає в руку, з нею приємно працювати, приємний колір, зручне розташування кнопок, хороші характеристики як для ігор так і для роботи в офісі. Я задоволений)
1,не советую для покупки
5,Очень хорошая мышка для игры и для работы советую :)
5,Дизайн улетный, шнур на тканевой основе добротный. Подсветка - бомба. Качество отличное. Ребенок в восторге!
5,Рекомендую всем тем , кто любит разноцветные тона , яркие краски , и жосткий огонь!
5,Мишка СУПЕР, діти задоволені покупкою. Замовляйте, кого цікавить, не пошкодуєте!!!!
2,Покупали на подарок под елочку сыну. Ребенку поравилась. Очень яркая подсветка, красиво смотрится. Достаточно тяжела и не сдвигается от легкого касания. В руке лежит удобно, и во взрослой и детской. НО! Есть огромный недостаток....читаем ниже.
4,Хорошая мышь за звои деньги РЕКОМЕНДУЮ.Неплохой подарок .Право перед испльзыванием лечше протиреть тряпкой или тканью. Очень доволен покупкой
5,Купил сыну.остался доволен..
5,Мышка просто бомба, да ещё за такую цену. DPI отлично работает, подсветка яркая, не скрипит, удобно лежит в руке. Рекомендую, деньги на ветер не выбросите.
5,Мышка хорошая, пользуюсь уже около 2-х недель. Подсветка очень яркая, но есть 1 минус а именно что после выключения компьютера сбивается настроенная подсветка, ну и мелкий минус, если взять мышку в руку она начинает скрипеть ну это уже придраться не к чему.
5,#мояраспоковка Мышка довольно великолепная. Большая так как я говорил на видео, мне такие по душе. Для игр довольно отличная мышь, а цена ваще низкая при нынешних ценах. Светится вся такая , приятно смотреть. Смотрите мой обзор , там старался рассказать и показать как можно больше.
5,Клас вона такка аласна це відео #моярозпаковка будьласка можете його добавити в відео про мишку
5,Чёткая, для CS GO самый раз)
5,Покупкой доволен, все отлично! Светится ну оочень красиво! РЕКОМЕНДУЮ!
4,Брал вместе с ковриком Gemix W-03, что коврик, что мышь оба исполняют свою работу качественно. Мышь достаточно хорошая, есть доп. кнопки, подсветка тканевая оплетка, все работает а не как у большинства дешевых игровых мышей, но сбивается прицел при резких движениях в игре, слишком большая.
5,Недавно купил этот девайс, уже ожидая чего-то плохохо, но мышка прекрасная. Классная система подсветки для разного DPI, по дизайну не уступает мышкам по цене 1к+. Очень доволен покупкой.
4,А можна перенастроїти бокові кнопки для регулювання гучності? Хто в курсі?
5,Отличная мышка. Все работает, качественно выполнена, очень красиво светится.
5,#мояраспаковка Получил вчера данную мышь, пришла за 2 дня, удобно лежит в руке, подсветка еще лучше, чем на картинке, современный дизайн, для CS GO и Paladins подходит идеально, 4 типа DPI (600, 800, 1200, 2400), лично я пользуюсь 1200. Покрытие тоже на высшем уровне. Надеюсь прослужит долго. На данный момент очень доволен. Спасибо, Rozetka!
3,неудобные кнопки с правой стороны. как их отключить кто знает?
4,для кс не подходит для ДОТКИ то что нужно а для mmorpg просто супер. (В реале 2 раза красивей чем на любом видео или фото)
5,пользуюсь более недели недостатков не обнаружыл :) всем советую
4,Приятная на ощупь, красиво подсвечивается, на нижней стороне не совсем ровно наклейки налеплены, коробка склеена так же не на 5 балов :). Прокрутка (колесико) работает нормально. В общем снял не большое видно где детально видно все её стороны :)
3,Мышь красивая, на ковре ведет себя нормально, колесико работает но только когда на него нажимаешь он залипает !
3,Вполне не плохая за свою цену,только плохо работает правая кнопка мыши :с
5,Всё бы ничего но подёргивания бесят
5,кому интересно зайдите гляньте обзор, я не про так что, если что исправьте в коментариях
5,для игр отлично за такие деньги.рекомендую.шнур отличного качества.шнуровая оболочка.подсветка привлекательная.кнопки работают отлично.колесико плавное без пробуксовки.
5,Классная мышка! Юзаю уже неделю в паре с ковром Sven GS-S, ведет себя прекрасно, сенсор просто чума, кнопки удобно расположены, отлик моментальный... Всем советую.
5,Играю в свой любимый Сталкер. Все круто. Удобная.
5,Сын доволен,особенно подсветкой,практически игровая мышь.
5,Красивая подсветка, хорошо лежит в руке, удобный вес, мышь не скользит, колесико работает нормально, все кок
3,Непрокручивает колесиком страницы.???это неиспраность?или глюк драйвера? если неисправность тогарнтийный ли случай?
5,Мышка приятно ложится во взрослую руку, имеет правильно подобранный вес - она не сдвигается от случайного легкого касания ее корпуса или кабеля, но при этом легко скользит при целенаправленном перемещении. Мышь сбалансирована по центру масс - перенос в процессе работы осуществляется двумя пальцами без особых усилий по ее удержанию, при этом она не запрокидывает ни "нос", ни "хвост" и не цепляется лучом по поверхности (как было в моей предыдущей). Корпус устойчивый, куда бы ни прикладывал усилие - ножки не отрываются от поверхности. В местах хвата по бокам корпуса есть пазы для вентиляции под пальцами - нет неприятного ощущения липкости при касании. Верхняя поверхность имеет приятное на ощупь покрытие - оно кажется теплее пластика. Колесо прокрутки имеет резиновую "покрышку" с неглубоким рисунком протектора - грязь, по идее, собираться не должна. Проворот колесика легкий, но с четкий фиксацией положения. Кнопки нажимаются плавно, клики при этом мне громкие. Боковые кнопки большого размера - легко попасть не гляда, но при этом, они не путаются под большим пальцем, когда в них нет необходимости. Переключателем СPI можно адаптировать мышь как для работы с различными разрешениями и размерами экрана, так и под выполнение различных задач. Работать в MS Word, AutoCAD, Solid Work, 3DsMAX и гонять чертей в стрелялках одинаково удобно. Сборка на очень приличном уровне - корпус не скрипит, не люфтит, кабель имеет тканевую оплетку, но при этом, он мягче, чем у моей старой мыши без таковой. Внешне выглядит очень красиво, особенно вечером - подсветка ненавязчиво меняет свою яркость. Упаковка просто шикарная - жалко выкидывать.
5,спасибо куму за подарок! мыша просто БОМБААА! красивая, удобная, приятная на ощупь! не понимаю предыдущий отзыв: - гарантия на нее 12 месяцев - очень прикольная подсветка, переливающаяся - длинна кабеля ПОЛТОРА МЕТРА! это короткий кабель??? при чем сам кабель в тканевой оболочке даже ферритовое кольцо есть-хотя не понимаю зачем оно тут, какой-то геймерский прикол наверное.
2,Мышка не плохая, но вот колесико не работает. Не знаю, отправлять назад или нет, совсем нет желания опять платить за пересылку. Мышку брал на время.
