5,Мышка отличная, но я собираюсь ставить 10 виндовс, подходит ли она к нему?(На коробке пишет виндовс 10 и 8.1 не указаны)
4,Классная, удобная, но при прокручивании колесиком, в разном положении колесика, клик же ним затруднителен. В одном положеннии мягкий, но стоит сделать почти оборот колесиком и нажатие ним сразу становится тяжелым, очень жесткое. Дефект.
5,Сын подарок оценил, игрался вечер с настройками и подсветкой :)
5,Купил месяц назад -пока претензий нет.
5,Крутая мышка короче))) Для КС:ГО самое оно!!Всем советую!!!
4,Честно говоря не думал ее брать, цена выросла. Но для хорошей мышки не жалко, к тому же здесь немалый срок гарантии. В мышке есть наверное все что понадобится как и геймеру так и обычному пользователю...Очень удобна, хорошо сидит в руке, приятная матовая, шершавая поверхность, рука по мыши не скользит. Быстрый отклик, достаточное количество кнопок. Не понравилось только колесико, в недостатке описал.
5,Мышка ок, очень удобная.
5,Хорошая мышь, возможность гибкой настройки под себя, красивая настраиваемая подсветка, светится как новогодняя елка)). Мега резвая и удобная, приятное прорезиненное шершавое покрытие, отличный дизайн.
