5,Первое ощущение после малюсенькой лоджитеч - караул, что за булыжник! Через сутки мнение капитально изменилось. Отличная мышь, как для игровых целей так и под особые нужды. Брали для работы с макросами, идеальная) Сперва показалось, что большая, особенно для женской руки, но дело привычки, через сутки рука привыкла, очень комфортно. Колесико ходит хорошо, начиталась в отзывах, что тугое - не заметила. Боковые кнопочки - нажимаются со средней силой, мягко, не надо вдавливать до одурения, мне нравится.
5,Отличная игровая мышь, с отличным отзывом. Брал на замену Razer Naga 2012 (MMO). Рекомендую!
5,Хорошая мышка, гибка настройка позволяет забиндить на 12 кнопок все что угодно юзеру. Радуют 5 профилей и кнопка которая позволяет быстро их переключать (под мышкой). Пользуюсь больше года, минусов кроме неудобной кноки дабл клика не обнаружил.
4,провод плохой ьак норм
4,Добрый день мышка прикольная удобная шустрая много настроек до этого была х7тож не плохая но эт больше нравится единствиное пока не могу разобраться с макросами может кто скинет ссылку на подробную инфо о макросах
4,Пользуюсь больше года. Никаких проблем со сборкой и качеством не обнаружил (Кроме одной опечатки на нижней стороне =) ). Боковыми клавишами пользуюсь исключительно редко т.к. в динамичных ситуациях их сложно нажимать. Так же и с кнопкой "двойной клик". В остальном все отлично.
4,Купил этот товар 5 месяцев назад. Вроде первые 2-3 месяца было все нормально, но потом мышка упал га колесиком в низ, и после этого колесико работает очень туго и для игр это не удобно. Потом правая клавиша мыши начала нажиматься туже и так по сей день
5,Купил недавно, впечатлений море.
4,Мне потребовалось время чтоб к ней привыкнуть. Мышка достаточно удобная, очень точная, я не чувствую дискомфорта при высокой скорости передвижения и легко попадаю туда, куда нужно, плавная (со старой x7 такого не было)
4,Как по мне мышка оправдывает свою цену, вопрос только как долго прослужит, но ввиду длительной гарантии это не сильно волнует (18 мес.). Пользуюсь вторую неделю, доволен.
