5,Купил где то 3 месяца назад всё отлично мышка удобная.
4,Год пользуюсь данной мышкой и очень доволен.Своих денег она точно стоит.
5,Дякую За мишку Все Курто
5,Купил знакомый говорил мыщка отличная дал мне поиграть мне понравилась решил сделать свою сборку мышь,клава,наушники,коврик но мышь закончилась скажите до 29 сентября будет мвшка в наличии? Зарание спасибо
5,К сборке мыши пока никаких претензий нет, все хорошо, но загвоздки есть в остальном. Первое - это драйвера. Они есть и даже работают, но найти их не так просто. Далее кнопки можно перебиндить левым софтом, все работает. Второе - в характеристиках указано что у мыши три режима 1000/1600/2000, но наклейка на мышке и коробка гласит "3200 dpi" и режима по сути четыре (красная, синяя, зеленая, фиолетовая подсветка). А как оно на самом деле - кто его знает. Мне хоть и не принципиально, но любопытно.
4,В принципе доволен.
5,вообще нужны драйвера для это мыши??? на офиц. сайте их нет
4,Пользуемся 2 недели, работает.
5,Очень качественная мышь, за такие деньги берите - не пожалеете!
5,Купил данную мышку! Доволен! Оцените мой обзор!
4,Не срывает сенсор,своих денег стоит,хорошая скорость отклика мышки на нажатие клавиш.
5,Пользуюсь ей уже 9 месяцев никаких проблем не обнаружено. Все нравится. Качественная сборка, хорошо лежит в руке, красивая подсветка, отличная чувствительность
5,Хорошая мышь за эту цену!
4,мышь топ но на 2 неделе резина на колесике отклеилась и стала прокручиваться без колеса. вначале подумал что мышь лагает но как срезал резинку выяснилось что все норм. обидно правда
4,Пользуюсь данной мышкой уже неделю. Товар хороший, мышка отзывчивая, сделана качественно, приятная на ощупь, удобная в руке. Из минусов могу выделить специфический запах, который за неделю пользования лишь чуточку сталь меньше (подозреваю что запах полностью пропадёт не раньше чем через месяц пользования)
5,Купил мышь для обычного использования и для игры в Counter-Strike Global Offensive. Отличная мышь и её цена.
4,Покупала парню на подарок, доволен как черт) Хорошая и недорогая мышка, а так же, можно изменять тяжесть мышки.
5,Достойная мышка в своей ценовой категории!
4,Срывает ли сенсор при резком розвороте?
4,Гарна миш, але має не приємний запах
5,Эта мышка превзошла все мои ожидания. Я думал за такую цену будет не очень, но она меня приятно удивила. Может и не топовая мишка но очень хороша. Надеюсь прослужит долго и у меня и у тех кто её купил..
5,Берите не бойтесь что неизвестный производитель!
5,Спасибо Розетке!!!)) как всегда, лучший сервис!!! Заказал на праздники, пришла на 2 рабочий день!)) Очень рад, СПАСИБО!))) покупал для кс-го , с такой сенсой глобал не за горами))) всем советую!!!
5,Отличный товар!
5,#мояраспаковка купил на замену Logitech mx500 (пробег с 2003г, присела левая кнопка), ну в целом при стоимости этой Centrophorus в 12у.е вполне достойная замена, Logitech стоила тогда кажется порядка 50у.е, по габаритам она конечно поменьше, ну не то что бы маленькая средние у нее размеры с угловатостями типа "игровая", логитеч по высоте где-то 1см была повыше, видимо привык за 14лет ))) потому, сейчас чувствуется не большая усталость в кисти, видимо пытаюсь держать как 500ку (шоб взял сразу как каменюку), с этой видимо руку нужно просто сверху держать, грузики съемные но даже с ними 500ка потяжелее была (там тоже кусок металла был), хотя вес ни на что не влияет (не заметил), клацается кнопочки хорошо (иногда отдыхаю в CS и вот 500ки клнить начинало "спусковой крючек", короче эффективность на 20% точно подняла), светится красным цветом, причем та же когда компик выключен, ну когда рука на ней-то не мешает, днем не мешает, ночью микро ночничок, ну то такое в целом ничего, 2 доп кнопки по левому борту (пока пользую разве что в браузере вперед назад), по центру кнопка выбора разрешения и колесико с кнопкой, драйвера не ставил никакие под Win7 работает в стоке, в целом с оглядкой на стоимость вполне достойный выбор
4,Получила в подарок, в общем довольна, удобная в использовании, но колесико все портит.
5,Да давненько у меня не было такой хорошей мышки , 2 моя покупка на Розетке и как всегда - Топ . Мышка очень приятно лежит в руке , прекрасная поверхность (на старой мышке был глянец и после 2 часов использования оставалась грязь ) на этой такого нет , грузики - хорошая штука , можете сами выбрать вес своей мышке (ну тут каждому свое) . Никаких проблем с драйверами нет , и неприятного запаха резины тоже , вообщем за такую цену мышка - топчик P.S Даже удивительно что такая низкая цена для этого дракона
5,За свои деньги отличная мышь, очень удобная, выше писали, что была проблема с драйверами, я при подключении никакой проблемы не обнаружил, пока работает отлично
5,получил мышь в тот же день. покупал для девушки. отличная сборка, очень красивая с красной подсветкой. идеальная мышь. всем рекомендую. #мояраспаковка
5,Отличная мышка, особенно девушке. Подарил жене друга. Играет в LoL и радуется каждый день.
1,Мышка хорошая и даже то, что нельзя делать свои макросы - не беда, НО даже действующие кнопки очень плохо прописаны. Т.е. банально когда хочешь в каком нибудь приложении добавить на эти кнопки действия, то приложения просто не видят боковых кнопок, что в свою очередь делает ее бесполезной.
4,Мишкою задоволений. Вона соїх коштів варта. Користуюсь 2 тижні і ніяких мінусів не знайшов. Для настроювання кнопок потрібно скачати з оф сайта драйвера.
4,Всё сказано в плюсах и - минусах. Играть можно 100%
5,Необычное покрытие которое кажется с начала неудобным но после недели пользования привыкаешь и кажется что это тот самый идеал.Не плохой сенсор,отличные переключатели.За эти деньги самый лучший вариант!
5,Очень хорошая мышка пользуясь уже месяц никаких нареканий нет
5,...все работает...в играх летает...WOT-отлично,без лагов и зависаний...скорость курсора переключает кнопкой DPI-1000 для интернета...2000 для игр...подсветка не напрягает...покупкой доволен:)
1,Купил мышь, крутая, не спорю, но, скачал сафт и тут подстава: все, что можно сделать с этой мышкой - это поставить уже забинденые команды (типа назад, вперед, калькулятор и т. д.). Теперь самый главный вопрос: почему, когда я задавал конкретный вопрос о том, есть ли возможность НАПИСАНИЯ макросов для этой мыши, мне ответил какой-то "ГОСТЬ" и то не верно? Такой функции для этой мыши НЕТ! Покупкой вообще недоволен, буду возвращать.
4,Подсветка яркая, оставляла блики на (матовом!) мониторе, да и о глазах пользователя явно вообще не думали. Без подсветки никаких претензий на второй день использования, пока всё устраивает.
5,У меня такой вопрос: есть ли возможность написания (не записи, а именно написания) макросов, если да, то предоставляется ли софт вместе с мышкой, если нет - где его взять?
5,#мояраспаковка Классная мышка,своих денег стоит,красивая подсветка,хорошо лежит в руке,даже не смотря на оптический сенсор,на минимальных настройках очень быстрая реакция,приятный прорезиненный scroll,настраиваемые макросы кнопок,при установке драйверов с оф. сайта,спасибо Розетке за доставку !
4,Мне мышь понравилась, очень удобна для игры в шутеры, аркады, танки. Можно очень быстро поменят dpi прям в игре, например в танки на минимум, в кс на среднюю.
5,Есть ли драйвера на эту мышь? Можете дать ссылку на них?
5,Мышь просто супер,очень доволен покупкой,добавить нечего.
4,-
3,Брать эту мышку совету на замену . Больше чем полгода мышка не выдержит . Знаю мз сопственого опыта .
4,За свои деньги - мышь превосходит всех что есть в приблизительной цене, играя в CS:GO чувствую себя отлично, лагов сенсора нет, но иногда проходят даблклики, очень сильно мешает.
5,Купил 25го сентября 2016го, юзаю два месяца каждый день очень активно. Все работает. Я хоть и заядлый геймер, но какую-то разницу в сенсоре между этой мышкой и дешевой мышкой, которая у меня стояла до этого 6 месяцев, так и не увидел... Все точно так же, только чувствительность можно менять на ходу кнопкой расположенной на корпусе. Эта мышь хороша другим - своей эргономикой. Очень, повторюсь ОЧЕНЬ! удобна. В руке лежит как литая, рифленая поверхность тоже как плюс. Кнопки нажимаются без каких либо усилий. Боковые кнопки расположены удачно. Внешний вид тоже не плохой. Колесико по началу крутилось туговато но со временем разработалось.
5,Мышь понравилась, пока только заказал по этому нечего больше добавить немогу
5,Отличная мышь за свои деньги.Довольно необычная подсветка в сочетании с логотипом(прозрачный пластик) который светится.Три режима чувствительности(соответствуют интенсивности свечения светодиода).
5,Хорошая мишка
5,Мышка просто обалденна, не зря мне советовали Defender. После покупки слегка пахла краской типа гуашь но не суть. Стоило мне руку положить как поняла что это моя мышка.Очень яркая и красивая.Длинный провод, высоко приделан и за счет этого нет лишнего шума. Она такая класная нарадоваться не могу. Испытала в шутерах, не подвела)
5,Очень понравилась!!!! Советую.За такую цену отличный продукт!!!!
5,Очень крутая мишка
4,После Наги не хватает выступа с правой стороны под пальцы, и длины мышки В комплектации написан - промокод, где его искать?
5,Какой подарок для Аллоды в инвайте?
5,Мишка прийшла швидко, при різких рухах сенсор не зриває, мишка крута ,тільки поки що не знайшов драйвера!!!
5,Очень хорошо сидит в руке!
5,Очень крутая мышка. Все советую. Если ты геймер у которого не много денег в кармане, или простой студент как я (на данный момент) то это твой выбор. Поверь она тебя не подведет!
3,До мене мишка шла два дня. Упакована була гарно. Виглядає неймовірно круто, брав для ігор. В дотці не відчув ніяких проблем. Дуже сподобався скрол хоч і потріскує.
5,Я заметил что у видео говорится что много режимов подсветки это правда?
5,Очень удобная мышь
5,Отличнейшая мышка, за такие деньги я лучше не нашел и думаю что вы тоже не найдёте. Красивый дизайн, отличная производительность, а также хорошо лежит в руке. Также мне понравился индикатор dpi который находится возле самой кнопки переключения. 20/60-цена/качество 20 из 20 за дизайн 40 из 20 за комфорт Советую брать!
5,Коли ця мишка з'явиться в продажу? Дуже хочю придбати! Чекаю Вашої відповіді
5,Для CS:GO и Dota 2 подойдет?
5,Очень крутая мышка. После обычных дешевый мышек, понял что такое настоящая мышка. Рука не устает. Берите не пожалеете. На картинке цвет подсветки оранжевый, а на самом деле он красный как помидор.
3,За такие деньги это отличная мышка!
5,удобно лежит в руке,
4,Пытался найти программу для клавишь на офф сайте, под данную модель нету. Если кто-то берет ради постановки макросов, не советую.
5,Только что пришла , очень удобная для 14 человека , сразу подключил и зашёл в Dota 2 и как не странно хорошо себя показала
4,ОЧЕНЬ удивило качество исполнения и сборки! Качество нормальное, даже хорошее! Если отрывать от поверхности НЕ скачет курсор. Удобное расположение у мышки боковых кнопок. НЕ навязчивая подсветка. В руке лежит удобно НО для не большой руки!!! В комплекте идет бонус код для Аллодов. От мышки из упаковки стойкий едкий слабый запах пластмассы. Не хрустит, не "клацают" кнопки (но слышны). Ход не большой у левой кнопки. ДПИ плавно меняются. Софта в наборе не было. Мышь действительно игровая, для игр вроде ВОТ(танки), ВОВ(кораблики), ВОП(самолетики). для КС не знаю , никогда не играл, но двойного клика в макросах нет.
5,Скільки видів підтсвітки вона має???
5,Очень удобная мышка. Очень понравилась.
5,Шикарный вид,выбираю между этой мышью и Lavawolf.Больше нравятся хар-ки у LavaWolf,но эта красивее.
