4,в цьому ціновому сегменті напевно найкращий вибір, тільки вот скільки вона прослужить.
5,Живе довго, за 3 місяці користування я не знайшов недоліків цих грошей вона варта
5,Отличная мышь, качество — великолепное, в руке сидит отлично, дизайн приятный и нажимается все легко. Дополнительные кнопки расположены нормально, спасибо за это. Ибо в большинстве мышек дополнительные кнопки очень неудобные. Из минусов, если уж придраться, то отсутствие подсветки. Было бы в целом неплохо, но тут уж кому как.
4,Мышь хорошая, стоит своих денег и здорово подходит для шутеров, напрягает лишь градация DPI в диапазоне 250. То бишь, даже через софт не выставить 400, 600 и тд.
5,До данной модели я перепробовал много разных мышек Steelseries, поэтому есть с чем сравнивать. Пользуюсь пока что только 1 день, но уже по опыту могу сказать, что довольно таки не плохой вариант, если брать в учет акцию конечно же, за такие деньги, я считаю, отличный вариант, ничего лучше за такие деньги НОВОГО вы не найдете. Мои мышки, например kinzu, kana, у них после 2-3 лет использования начинаются проблемы с кликом, стирается пластмаска которая клацает на кнопку внутри мышки и становится очень проблемно на этот клик нажимать. Надеюсь что в этой мышке клик прослужить дольше). Вообщем я доволен и мышкой, и ценой, очень быстрая доставка, закал во вторник, в четверг была уже на руках через НП, спасибо розетка! Вот единственное, что не ожидал - это DPI, я привык играть на 400 DPI и сенс 2.4, а теперь пришлось выставить 500 DPI и менять сенс((( но по сути это никак повлиять не должно, т.к. в соотношении вышло тоже самое что и было. А и еще хорошо что стоят тефлоновые глайды, скользит норм, а то был опыт когда на кана стояли какие-то другие и совсем не скользили, приходилось менять, тут с этим все ок.
5,Определённо для кс подойдёт... Такие флики на ней даю Советую всем
5,Мышь пришла очень быстро, заказал в субботу в час ночи))) Отправили в субботу около 5 вечера, забрал в понедельник после работы, в 7 вечера) Первое впечатление, мышь качественная, без подсветки, кнопки работают отлично, все без исключения. Немного разные по нажатию боковые клавиши. Но наверное так должно быть. Скролл шикарный, четкий, немного жестковат. Провод хороший, легко гнётся и выпрямляется. Защита от перегиба. Сенсор отличный, после перехода с офисной мыши как Небо и земля. Не сильно пачкается. Клики все четкие. Низкая высота отрыва. В общем все четко.
5,С самого начала выпуска купил эту мышь. Очень доволен мышкой. Всегда четка и уверенная в играх. Играю с очень маленькой чувствительностью.
5,Мышью доволен,надеюсь прослужит как можно дольше ибо когда то купил тут sensei, так он через 3 года сломался.
5,отличная мышка
5,Обычная бюджетная мышка, не стоит ждать от нее чего то. Вполне оправдывает свои деньги
5,цена - качество
5,Довольно удобная мышь))
5,Как узнать резулдьтыты акции?
5,Есть ли на этой мыши подсветка и какого цвета?
5,Часто ломается ЛКМ вопрос?
5,У меня мышь уже месяц.Пока нормально ,но беспокоят отзывы о ЛКМ ибо оно часто ломается.Знаю что вопрос глупый ,но все же Вопрос к Представителю много ли к вам обращаються людей с данной проблемой?и сколько дней длится ремонт такой поломки?))
4,Придбав мишку нещодавно сервіс інтернет магазину Rozetka.ua доставив мишку швидко. Мишка відповідає своїй ціні.Приємна на дотик. Кнопки не хитаються #моєрозпакування
4,Купил мышь на замену bloody V2, Вообщем мышь очень понравилась
5,Удобно ложится в ладонь, колесико хоть и жесткое, но быстро привыкаешь. Детям будет тяжело в пользовании #мояраспаковка
5,Брал на замену kana По размеру 1 в 1. При этом, все изменения от rival 100 я бы занёс в плюс. Нет soft-touch? Он собирает тонны жиры и стирается. Нет подсветки? Наконец-то! По итогу имеем рабочую лошадку за вменяемые деньги.
5,Удобно сидит в руке, не скользит. В играх двигается шустренько. Доволен ценой, за такие деньги отличная качественная мышь. Советую всем! #мояраспаковка
4,Пользуюсь данной мышью практически месяц. Левый и правый клик нажимаются достаточно тяжело, но примерно через неделю привык. Удобная форма, хороший сенсор радуют. Надеюсь хватит надолго, на данном этапе проблем с кликами нет.
5,Хочу взять мышь для csgo.как думаете брать или нет?Читали что у многих ловаеться левый клик
4,Очень крутая мышь за свою цену
4,Сразу скажу, я не геймер, мне просто нужна была удобная практичная мышка. До этого кучу лет пользовался bloody v7 и v7m. Боялся, что эта мышь будет менее удобной, т.к. короче на 5 см., но мои страхи развеялись: мышь идеально сидит в руке. Здорово, что есть переключение dpi, но плохо, что только 2 режима. Пластик дешевый, без софт-тач, что доставляет небольшой дискомфорт. Боковые кнопки ооочень шумные. Гремит при прокрутке скрол, как на дешевых китайских мышках. Нажатие левой и правой кнопок более тугое, что тоже доставляет небольшие неудобства. Не знаю, как для гейминга, но для работы bloody мне нравилась больше.
4,Приятно удивлен. Хорошо отслеживает, приятная форма, и отрыв вполне неплох. Брал что-бы "дешево и сердито," так и получилось. По качеству сборки пока не отозвусь, пользовался мало, но держать в руках и пользоваться ею - абсолютно не напряжно. Недостатков вроде-бы и прилично, но несущественные.
1,через 2 месяца сломался левый клик. банально отломался кусочек пластмассы который нажимает на переключатель. естественно это не гарантийный случай. это ж из чего нужно было сделать?! мышь очень понравилась, если бы не одно но....
5,Идальный вариант на эти деньги! Пользуюсь уже месяц. Кайфую.
5,Нету денег - Rival 95.
4,Мышь, которую по достоинству оценят лишь искушенные геймеры, которым я не являюсь. Товаром в целом доволен.. На официальном сайте присутствует софт (даже для MacOS), который позволит настроить данный девайс под себя. Для моей руки мышь немного легкая, но думаю это дело привычки)
5,#моя распаковка
5,Ну что вам сказать по поводу этой мыши: Короче пользуюсь ней уже больше месяца и на удивление все просто круто! Приятная в использовании, удобно лежит в руке, не лагает, не скрипит как большество дорогих топовых девайсов, качество сборки у SS на высоте! Я бы даже сказал самый лучший не дорогой бюджетный вариант геймерской мышки как по мне! Единственный маленький минус этой мышки, это нестандартная частота CPI (250, 500, 1000 и т.д.)
4,Пришла эта мышка сегодня, до этого пользовался Rival 100, попозже дополню комментарий ощущениями и сравнением с Rival 100.
4,Пользуюсь неделю - пока-что доволен, а там время покажет. Хорошее качество сборки, то что нет покрытия на пластике - для меня плюс(ладонь непотеет как на моей бывшей A4Tech XL-730K), точность и работа сенсора отличные(DOOM прошел в несколько раз быстрее чем с A4Tech XL-730K, иногда было ощущение что играю на легком уровне), отсутствие подсветки ненапрягает - подсветка была б желательна на кнопке переключения DPI, чтоб менялся цвет при разном значении. Из минусов для меня: 1. Только две позиции переключения DPI(1000 или 2000, а не пошагово от 250 и до 4000 и то лишь можно задать с помощью ПО). 2.Заданные значения DPI и настройки клавиш неработают при выключенном ПО(на старой A4Tech XL-730K раз настроил действие и можно подключать к любому компу без ПО A4Tech - настройки непропадают).
2,Через три недели отказала ЛКМ. Резко, без "глюков". Пропал характерный "клик" и нет реакции на нажатие ЛКМ. Остальные кнопки работают без проблем. Честно говоря, это стало неожиданностью, так как выбирал мышь, исходя из отзывов пользователей. Первый раз купил Steelseries. Надеюсь, что просто мне попался бракованный экземпляр. Сегодня отправил назад в Розетку на Гарантийный ремонт... Надеюсь на скорый ремонт или замену, так как в целом мышь понравилась. Дополню комментарий по мере развития событий. Пока, расстроен.
5,Подарила парню на день рождение, каждый раз слышу огромное спасибо) Отличная, простая мышка, без наворотов, но работает на все 100%. Можно настраивать под себя!
5,Очень хорошая мышка!Приятный дизайн и очень удобная.Провод очень прочный.
5,Купил неделю назад, мышка очень нравится, один из лучших вариантов за эту цену.
5,Дивиться мій обзор і коротку думку.
5,Пришла за 3 дня все супер
4,Отличная мышь за свою цену. По цене бюджетная (если принимать во внимание бренд, конечно), но по качеству мало в чем уступает более дорогим "мышам" (сравниваю с продукцией самой Steelseries и Razer).
5,посылку получил в отличном состоянии щас буду проверять какая она в деле ...
5,#моя распаковка
5,Мышку заказывал сын. Он и выбирал себе мышку. Получили мышку очень быстро. Через день после оплаты. Мышка сыну понравилась. До этого заказывали клавиатуру. Тоже все ок!Благодарю!
5,Хорошая мышка, красивая и удобная, в cs go показует себя отлично. Спасибо розетке за мышь.
4,Вопрос к производителю , сколько данная мышь еще будет в наличии и будет ли еще поставка ?
5,А так доволен, сенсор отличный, лучше любой там х7) А так, время покажет
4,А когда мышь поступит в продажу ?
5,Вопрос к представителю: к концу этого месяца поставка товара будет?
4,Сенсор просто pixart 3059 ?
