5,Всё нормально, дешевая рабочая мышка
5,Хорошая мышка, купил примерно год назад . Полностью оправдывает себя за свою цену самое оно. Советую всем любителям халявы.
5,Довольно качественно сделана. За свою цену, по моему, хорошая мышка.
5,Мышь очень классная, удобная и красивая. Всем заявленным характеристикам отвечает.
3,В деяких випадках тачпадом краще користуватись
4,працює бездоганно
5,Мышка для работы подходит идеально
5,Простая и удобная, хорошего качества!
5,С теликом lg сконектился. Все отлично
5,Купила безпроводную мышь. Очень хорошая.
1,Ужас ужасный
3,нормальная
5,Отличная мышь, работает больше года. Выдерживала все, и монотонную работу и игры. Очень хорошо сидит в руке и шустро двигается. Бывает в тишине колесико бесит когда поскрипывает, но это не страшно. Всем рекомендую!
4,Рекомендую!
5,Всё оперативно и в срок! Отменный продавец!
3,По совету представителя компании сменил батарейки результат тот-же.Отослал в сервис,жду уже 10 дней.Надеюсь на положительный результат.
1,Купил в офис 3 штуки, кнопка прожили недели по 3 , теперь кликают через раз. Связь держит не очень. К покупке не рекомендуется.
1,мышка пришла не рабочая.не рекомендую
1,Что делать?Вставляю батарейки их хватает от 20-60мин.в зависимости от фирмы,что с мышью первый раз встречаюсь с таким приколом.
5,Лучшая мышка в своей ценовой категории. Рекомендую.
4,Мышка не впечатлила.
5,Компактная мышь, хорошо сделана на люфтит не скрипит, сверху глянцевый пластик, по бокам софт-тач. матовый. Приятный внешний вид. 3 года гарантии. Батарейки в комплекте. Батарейки в отсеке не болтаются, я свои еле вставил, сидят плотно. Подключил к Андроид ТВ-боксу Т95Z Plus, бокс увидел мышь сразу, пользоваться удобно. Переключатель скорости режимов тоже порадовал. Хорошая мышь. Посмотрим сколько проработает. Благодарю Розетку за быструю доставку в пункт выдачи.
4,Пользуюсь 4 месяца, пока все устраивает
4,Батарейки сразу в утиль. А так нормальная мышка. Правда для большой руки неудобна.
1,Пластина в USB слишком толстая. Он просто не влазит. Отправила заявку на возврат.
5,Дуже легко розібратися, підключити. Можна включити - виключити. Недоліків немає.
4,Для работы удобная. Для геймеров - вряд ли
5,Вживана три місяці. Проблем нема
4,Купил мышку. Через год использования просто перестала работать, но своё время отработала отлично, для небольших рук подходит отлично. За свою цену советую.
5,Мышку купил по телефону, когда подтверждал покупку ноутбука, не удержался против очень заманчивого ценового предложения оператора. Так как цена маленькая, ожидал что-то не очень качественное, но когда получил, был очень удивлен. Доставили в фирменной коробке, в комплекте шли 2 батарейки типа AAA, что не может не радовать. Мышка небольшого размера, но отлично легла под мою немаленькую мужскую руку, можно пользоваться как левой, так и правой рукой. Сделана из глянцевого материала, поэтому немного остаются отпечатки. По работе никаких претензий нет, даже более, я доволен на все 100%, подключилась к ноутбуку моментально и без всяких "танцев с бубном", и установок драйверов. Отлично себя показывает на абсолютно любой поверхности, колесико сделано качественно, имеется кнопка для изменения чувствительности. Основные кнопки мыши нажимаются легко и негромко. Если ее не использовать какой-то период времени, она отключается, тем самым продлевая жизнь батарейкам. Для включения мыши достаточно два раза клацнуть кнопкой. Если же хотите отключить полностью, на нижней панели имеется выключатель. Настоятельно рекомендую к покупке!
3,колесико постійно заїдає в одному місці, треба докладати зусиль, щоб прокрутити.
1,Купил 2 мышки на работу, пока батарейки были родные, то работала месяца 4. Через пол года первый экземпляр начал очень быстро садить батарейки, а второй сломался и что самое обидное, что все делается так, чтобы вернуть мышку никому не удалось, потому что, как выяснилось, на самой мышке серийный номер не пишут (он только на упаковке, упаковку выбросили), а без серийного номера по гарантии не принимают. То есть всем счастливым владельцам данной мышки придется хранить упаковку 3 года. Вообщем, товаром не доволен, лучше доплатить еще 150 грн и купить Logitech, которые проверены годами.
5,Первую такую мышь получил в подарок к ноуту от розетки, вторую заказал коллеге. При постоянной работе в офисе батареек из комплекта хватило на 6-7 месяцев примерно. Кнопка дпи помогает при работе с графикой (насколько я понял методом тыка - 3 варианта разрешения, переключаются по порядку нажатием кнопки). За такие деньги лучшего варианта нет. Цена, удобство, качество - супер.
5,Купила эту мышку, батарейки, которые шли в комплекте разрядились спустя месяц. Теперь поставила акамуляторы. Работает без нареканий, не глючит и не живет своей жизнью. Для игр и работы с графикой не совсем удобна, скорее для работы и учебы и сёрфа в интернете
1,Отвратительная мышка! Курсор живет своей жизнью. Все время гоняет по экрану. Работать просто невозможно. Для работы надо две батарейки, в то время как в большинстве других достаточно одной. В общем сам не прав, что не увидел этого сразу и не почитал отзывы. Не рекомендую никому!
3,Очень неудобная для тех, кто планируем мышь часто тягать с собой. Так как модуль связь находится под крышкой батарейного отсека. И чтобы его закрепить-достать надо каждый раз открывать батарейный отсек.
4,Мышь как мышь. Для офисной работы подойдет. Действительного небольшого размера.
5,Дуже радий цією покупкою
5,отличная мышка)
5,как только купил понял что это то что нужно!!!!!!!
4,Удобная.
3,товаром довольна надо только наловчиться работать
5,Совместима также с Linux(Ubuntu как минимум в моем случае), включил и никаких танцев с бубном. На первый взгляд может показаться маленькой, если у вас до этого была побольше мышь, но как по мне - золотая середина в плане размера.
5,подключил, работает. за такую цену отличный вариант.
4,Практичная мышка. Без проводная!
4,Неплохая мышь за свои деньги. Пользуюсь второй месяц работает отлично.
5,Довольная покупкой!
4,1
4,Хорошая мышь, простая и удобная. Спасибо Розетке з оперативность.
5,Пользуюсь 4 месяца. Батарейки меняла один раз. Сейчас куплю такую папе)
5,На твердую пятёрочку
3,за свои деньги - пойдет
5,Перші враження чудові, нічим не гірше за аналогічні, але дорожчі миші Logitech. Подивимось, що буде через пару місяців.
4,батареек хватило на чуть больше месяца... поставил дюраселл, пока полет нормальный. дальше посмотрим
5,Для смарт ТВ підійде?
3,Мыша - чумовая! Но есть нюансы... Собственно нюансы: Эта мыша не простая, эта мыша - КВАНТОВАЯ! То ли мыша так спроектирована мудрыми китайскими конструкторами, то ли она так сделана рукастыми китайскими рабочими, но при установке двух пальчиковых батареек ААА в БАТАРЕЕЧНЫЙ отсек, батарейки начинают подчиняться принципу неопределенности Гейзенберга: невозможно однозначно сказать, в каком месте отсека они в данный момент находятся и какой скоростью обладают. Можно только констатировать, что в силу приобретенных волновых свойств, батарейки могут с некоторой вероятностью присутствовать в любой точке пространства отсека, а сама мышка наделяется дуальностью кота Шредингера, который одновременно совмещает живое и мертвое состояние. И всё это - ещё при незащелкнутой крышке отсека!!! А вот с щелчком защелки система моментально приобретает определенность: кот дохнет с вероятностью 146%! Наряду с этим мышка приобретает массу новых незадокументированных свойств: она может служить, как пресс-папье; может выступать, как маракас (благо, степеней свободы у батареек меньше не стало). Вот только по-своему прямому назначению - манипулятора - не судьба.... В своё время Мао Дзедун мне сказал: "Купи эту мышь обязательно! Повезёт - станешь счастливым юзером, не повезёт - станешь музыкантом". Не знаю, может мне сразу маракас нужно было купить? А может нужно было при разработке просто предусмотреть фиксаторы положения батарей и проверить габариты отсека?
4,Покупал в подарок внуку. Парень очень доволен. Это именно то, чего ему не хватало.
5,Чудова мишка, купувала хлопцю, користується вже кілька днів- поки йому все подобається)
4,Мишкою задоволений. Користуюсь уже більше 6 місяців. Завдяки своїм розмірам не займає багато місця. По категорії співвідношення ціна/якість напевно один із найкращих варіантів.
5,вполне адекватная мышь
5,Не плохое качество мышки, есть с чем сравнить, до этого была дешевая (решила сэкономить- ужас, намучилась я с ней).
4,Сегодня забрали посылку. Вполне достойное качество, за такую цену.
5,Пользуюсь давно и довольно часто . Могу с уверенностью сказать вещь отличная - советую.
4,Чётко работает, без прыгов!)....Не смотря на малые размеры очень удобна в работе!!!....Боковые прорезиненые вставки, хорошо удержываются!!!
5,Достоинства: Цена, комплект (батарейки тоже в комплекте), гарантия Не требуется никаких настроек: включил, автоматически установился драйвер, до трех метров точно работает (дальше не проверял). Удобная в руке. Пользуюсь чуть меньше недели. Недостатки: пока не выявлены Подробнее: http://hard.rozetka.com.ua/trust_20322/p2438732/comments/#comment_form
5,все супер. претензий нет.
5,Довольно быстро (пара месяцев) сели батарейки, которые были в комплекте. В остальном мышь шикарна. Прекрасно работает и на лакированном столе, и на матовой поверхности.
5,Дешево и сердито!) а вообще доволен мышкой, пока пользуюсь ей(чуть больше месяца) - нареканий еще небыло, работает на большинстве поверхностей(в моем случае большинство времени мышь проводит на покрывале и на столе), за такие деньги 3 года гарантии просто нереальное преимущество!)
4,Купив на днях, покишо працює. Трохи незручна в руці, але звикнути можна.
5,Замечательная и удобная мышь на свою стоимость. Спасибо продавцу Александру за совет. Очень довольны.
4,Получил. пользуюсь неделю. всё нормально работает.
4,За эту цены, с такой гарантией, ничего другого нет!
5,В соотношении цена/качество мышка супер. Пользуюсь 9 дней - всё отлично работает.
5,мышка очень удобна в руке самая главное сама отключается когда ей не пользуюсь дизайн очень хорошо сделан сове тою не пожилеите
4,Ціна/якість - дуже непогана пропозиція за таку ціну.
5,Мышка маленькая ,удобная.Работает отлично .Мне лично нравится .
4,В целом хорошая мышь, хорошее соотношение цены и качества. Кроме скролла, собрано очень хорошо,
5,Купил сравнительно недавно,но могу сказать что очень даже хорошо себя ведёт-советую.
4,Покупал недавно, пока все устраивает. Своих денег стоит на все 100%. Для сравнения недавно брал безпроводную HP которая стоила больше, при это батарейку жрала как бешеная ( за пол года работы одних батареек сожрала на три своих стоимости), а потом еще и скролл перестал работать адекватно
5,Покупал мышку сразу вместе с ноутом, доволен что одной покупкой что другой. Мыша работает отлично, клавиши не западают, отклик довольно быстрый. Аккумулятор не разрядился за четыре месяца ежедневного пользования. Еще большой плюс клавиши DPI, очень удобно и всегда под рукой)))
5,Пользуюсь уже недели 2, всё хорошо. Взял чтоб на расстоянии пользоваться мышью, когда ноут подключен к телевизору. 2 - 3 метра тянет точно (больше не проверял). Отличная мышь.
4,Удобно,практично для Acer Aspire ES1-111M-C09T (NX.MRSEU.002)
4,Мишка небольшая по габаритам, потому Вам решать достоинство это или недостаток. Соотношение цена/качество весьма привлекательно. Плюс весьма располагает к симпании гарантия в 3 года.
5,Мышка реально отвечает всем критериям , как пользователя , так и игрока !!! Рекомендую.
5,Сразу закрадывалось много подозрений, почему мышь подобных характеристик стоит так дёшево. В результате так и не понял... Но! Мышь отличного качества, двухрежимная, несмотря на компактный размер очень удобная. Главное достоинство - лазерная! Никаких проблем с датчиком на любой поверхности! Прорезиненность, конечно, мнимая, но её присутствие (а точнее отсутствие) практически не замечается после того, как мышь ложится в руку (или рука на мышь). Всё остальное, включая трёхгодичную гарантию, заслуживает самых высоких похвал! Рекомендую настоятельно всем лаптопникам!
5,dpi очень кстати, удобно и играть и работать
