5,Пользуюсь уже год. Никаких нареканий нет. Все в лучшем виде. Качество сборки порадовало.Очень хорошо лежит в руке.
1,Здравствуйте! Пару месяцев назад купил эту мышку и некоторое время назад колесико мыши начало сильно глючить при скроле. Какие есть варианты исправления этой проблемы?
5,мышь по первым впечатлениям отличная: органомика, материалы, к качеству сборки нареканий нет, цена особенно порадовала =) в остальном время уже покажет. правда вот компакт-диска с программным обеспечением в комплекте у меня не оказалось, не то что бы мне это было принципиально в век интернет технологий )) но комплектацию в описании стоит подкорректировать_что б людей столку не сбивать. а в остальном всё нра =)
5,+
4,иногда уводит в простое курсор,после беспроводной G700 пришлось привыкнуть.цена-качество отлично!
4,Хорошая мышь
5,Просто супер, нарадоваться не могу)
4,Легкая, Я привык к мышам потяжелее, но это уже личные предпочтения каждого
